product_name,price,discount,review_rating,review_amount,brand
El Lápiz Eliminador De Verrugas Es Seguro Y Efectivo Para La,82.270,10,0,0,Generic
"2 Cepillos De Limpieza Facial, Limpiador Facial De Silicona",121.047,0,0,0,Leeshine
"Limpiador De Poros Faciales Visual Acne Needle, Visualizació",131.337,0,0,0,Snuo
Bicarbonato Sin Aluminio. Kg. - Kg a $20994,20.994,0,5.0,7,sin aluminio
Suero Amplificador Para Pestañas Mucho Mas Largas En Flash,109.044,22,5.0,1,Flash
"Cinta Adhesiva Bucal Para Dormir, 120 Unidades, Tiras Suaves",48.332,9,4.4,10,Genérica
"Cepillo De Limpieza Facial, Limpiador Facial De Mano De Sili",97.991,0,0,0,Ejoyous
Vapor Ozono Brazo Expandible Registro Invima Envio Inmediato,229.900,0,4.7,9,BELLA STETIC
"Umickoo Exfoliante De Limpieza Facial, Cepillo De Limpieza F",260.900,0,0,0,Umickoo
"Limpiador Facial, Mini Spa Eléctrico 5 En 1",11.000,0,4.6,20,Brand not found
Cepillo Exfoliante Facial,22.000,0,4.1,9,GypsyMarket Co
Vapor Ozono Entrega Inmediata ,215.900,0,5.0,1,Brand not found
"8 Esponjas Faciales Coloridas Ovaladas De Limpieza Facial, E",115.283,0,0,0,Mollensiuer
Desmaquillante Ácidohialurónico - g a $150,8.990,0,4.0,1,Images
1 Sérum Reparador De 7 Días Para Eliminar Hongos En Las,64.302,2,0,0,Generic
Cepillo De Limpieza Facial Con Luces Rojo Y Azul Free Breath,514.800,0,0,0,Free Breath
"Gel Eliminador De Cicatrices Go Para Queloides, Crema Repara",48.680,8,0,0,Generic
"Glowskins Mascarilla Nocturna De Colágeno,12pcs",157.636,5,5.0,1,"generic,Facial mask,medicube,mascarillas faciales,mascarilla facial,face,Máscara,collagen mask"
"Paquete De 20 Cepillos De Limpieza Facial De Silicona Suave,",121.047,0,0,0,Nuogo
60 Cápsulas De Apoyo For La Limpieza Del Hígado,88.819,10,0,0,Generic
Vaporizador Facial - Limpieza Profesional Vapor Ozono,195.300,0,0,0,Genérica
Cepillo De Limpieza Facial Verde 3en1 Con Estuche - Queenwil,467.079,0,0,0,Queenwill
"Levanta La Cara Y Tensa La Piel, Lifting Facial Con Microcor",71.635,5,0,0,Generic
"Avilana Limpiador Facial De Silicona, Cepillo De Limpieza Fa",121.047,0,0,0,Avilana
"Sauna Spa Facial Eléctrico,vaporizador + Extractor De Puntos",78.900,0,0,0,Brand not found
"Gomitas Goli De Ashwagandha Y Vitamina D, 60 Unidades, Mezcl",71.737,0,0,0,Generic
"* 2x Nad Nicotinamida Riboside Resveratrol 900 Mg, Suplement",121.125,3,4.0,1,Generic
Cepillo De Limpieza Facial Rosa 3 En 1 - Lanbeibei,248.354,0,0,0,Lanbeibei
Depiladora Eléctrica Cuerpo Hilo Depiladora Facial Eléctrica,79.172,0,0,0,Generic
Unti Juego De Cepillos De Limpieza Facial Led Elctrico 6 En,282.443,0,0,0,UnTI
"Pomada Fúngica Para Onicomicosis De Uñas, 20 Ml, Para Esp",53.106,3,0,0,Generic
Sauna Facial Rostro Cara Vaporizador ,59.900,0,4.2,5,Osenjie
"Polvo Para Cubrir El Cabello, Sombra, Corrector Instantáneo,",48.680,8,0,0,Generic
Vaporizador Sauna Profesional ¡,49.090,0,0,0,Steamer
"Avilana Limpiador Facial De Silicona, Cepillo De Limpieza Fa",121.047,0,0,0,Avilana
Cepillo Delimpieza Facial 5en1,31.900,0,0,0,Genérica
Vaporizador Facial Benice Sauna Limpieza De Poros 52 Bits,67.324,0,0,0,52 Bits
"Cubreorejas A Para Ducha, 60 Unidades, Protección Auditiva,",48.680,6,0,0,Generic
Cetaphil Toallitas Limpieza Facial X 25und,45.700,0,5.0,1,Cetaphil
Vaporizador Spa Sauna Facial ,64.900,0,0,0,Osenjie
"Gerrii 960 Esponjas Faciales Comprimidas, Esponja De Limpiez",466.895,0,0,0,Gerrii
"Cepillo De Limpieza Facial, 2 En 1, Limpieza Profunda De La",142.829,0,0,0,XZYZYW
Solución Limpieza- Ácido Glicol - mL a $269,53.823,23,0,0,O Boticário
Dove Men Care Face Wash Hidrata 147ml - mL a $374,50.590,8,4.5,2,Dove
"50 Esponjas Faciales Comprimidas Para Esteticistas, Esponja ",121.047,0,0,0,Metuuter
Juego De Cepillos Giratorios De Limpieza Facial Recargables,153.943,0,0,0,Clsevxy
"Pomada Para Calambres K Leg, Natural, Para Aliviar Los Calam",48.680,8,0,0,Generic
Hidraderm Leche Limpiadora - Sesderma,115.900,0,0,0,Sesderma
Set Desmaquillante Y Jabón Faci - g a $60900,60.900,0,0,0,Natura
"Cepillo De Limpieza Facial Manual, Cerdas De Fibra De Carbon",144.104,0,0,0,Lingol
Cepillo Eco Bamboo Limpieza Facial ,30.900,0,0,0,Genérica
Botik Tonico Micelar Prebioticos 200ml,46.722,22,0,0,O Boticário
". Crema Hidratante Corporal, Crema For El Acné, Glúteos Y",44.255,16,0,0,Generic
"Dageda 2 Esponjas Faciales Konjac, Limpieza Profunda De Poro",115.283,0,0,0,DAGEDA
"Crema Útil Para Eliminar Lipomas, Crema Para Eliminar Lipoma",48.680,8,0,0,Generic
"Cepillo De Limpieza Facial De Madera, Cepillo De Limpieza Fa",86.463,0,0,0,Joyzan
Sauna Facial Vaporizador Limpieza Profunda Rostro Spa Vapor,44.301,16,0,0,Osenjie
Toallitas Limpiadoras Faciales Desmaquillantes Neutrogena,120.373,6,0,0,Neutrogena
"Chhwau Espuma De Lavado Facial, Fabricante De Latigos, Fabri",97.991,0,0,0,Chhwau
"Limpiador Facial, Mini Spa Eléctrico 5 En 1",11.000,0,4.6,20,Brand not found
Cepillo Exfoliante Facial,22.000,0,4.1,9,GypsyMarket Co
"Agua Micelar Garnier Con Ácido Hialurónico, Limpieza Facial.",158.859,0,0,0,Garnier
Limpieza Facial Sónico Daily - Unidad a $202930,249.900,13,0,0,Conair
Vaporizador Facial Recargable,16.054,0,3.8,4,Nano Spray Water YL882
Toallitas De Limpieza Facial Cetaphil 25 Unidades,56.900,0,5.0,1,Cetaphil
"Nagracoola Clie - Cepillo De Limpieza Facial, Cepillo De Lim",311.264,0,0,0,NgraCoola
Vaporizador Facial Para Limpieza De Rostro Abre Los Poros,52.900,0,0,0,Genérica
Exfoliante Hombre Barbershop Rost - Unidad a $34990,34.990,0,5.0,2,Barber Shop
Vitu Primer Algodón Facial 28ml - mL a $711,19.900,0,0,0,Vitu
Cepillo Limpieza Facial Exfolia,14.900,0,0,0,Genérica
"Revex Exfoliante Facial De Silicona, Cepillo De Limpieza Fac",109.519,0,0,0,Revex
"Agua Facial De Rosas, Fresas Y Pepino Na - mL a $33",16.500,0,5.0,3,Natural Sant
Leche Limpiadora 250ml ,19.900,0,0,0,AGRADO
Vaporera Facial Terapia Rostro,79.900,0,0,0,Vaporizador Facial Aromaterapia Limpieza Belleza Facial
Limpiadora Facial Eléctrica Reca - Unidad a $156944,156.944,2,0,0,Generic
"Cepillo Facial Para Limpieza De Uñas, 10 Unidades",97.493,0,0,0,Genérica
"Toallitas Faciales Simples De Limpieza, 25 Unidades (paquete",181.254,0,0,0,Simple
"Toallitas Faciales Desmaquillantes Suaves Cetaphil, Limpieza",105.017,0,0,0,Cetaphil
Vaporizador Sauna Facial Limpia,73.627,7,0,0,Vaporizador Facial Aromaterapia Limpieza Belleza Facial
 ,0,0,0,0,
"Cepillo Facial Para Limpieza De Uñas, 6 Piezas",75.381,0,0,0,Genérica
Cepillo De Limpieza Facial Eléctrico Para Masaje Exfoliante,237.245,29,0,0,Generic
Toallitas Faciales | Limpieza Facial De Árbol De Té Y Maquil,160.470,0,0,0,Body Prescriptions
Limpiador Facial Y Corporal En Gel Espumoso Svr Sebiaclear -,192.154,0,0,0,SVR
Toallitas Faciales | Limpieza Facial Con Retinol Y Maquillaj,160.303,0,0,0,Body Prescriptions
Vaporizador Sauna Spa Facial Eléctrico Limpieza Terapia     ,59.900,0,0,0,Brand not found
Nuogo Paquete De 20 Cepillos De Limpieza Facial De Silicona,115.055,0,0,0,Nuogo
"Cepillo De Limpieza Facial De Silicona 2 En 1, Limpiador Fac",95.879,0,0,0,MtBoi
Toallitas - Paños De Limpieza Facial De Algodón Orgánico,176.400,0,0,0,Genérica
Sauna Facial Vaporizador Limpieza Profunda Rostro Spa Vapor,57.900,0,4.7,6,Osenjie
"Toallitas Faciales Simples De Limpieza, 25 Unidades (paquete",219.209,0,0,0,Simple
"2 Esponjas Faciales, Almohadillas De Limpieza Facial, Esponj",102.271,0,0,0,Consio
"Cepillo De Limpieza Facial, Exfoliante Facial Eléctrico De S",184.852,0,0,0,Mdswzai
Yambal Jabón Limpieza Facial,23.023,23,0,0,Yambal
La Pocion Kit Limpieza Facial,78.000,0,0,0,La Poción
"Toallitas - Toallitas Faciales, Limpieza Facial Burt's B",111.600,0,0,0,Genérica
Nuogo Paquete De 20 Cepillos De Limpieza Facial De Silicona,179.858,0,0,0,Nuogo
Viaje Toalla Desechable De Limpieza Facial Toallita Papel,53.239,19,0,0,Genérica
Cepillo De Limpieza Facial Usb - Unidad a $37900,37.900,0,0,0,Genérica
Toallitas - Toalla Facial De Limpieza Desechable Ougeer ,153.600,0,0,0,Genérica
"Cetaphil Paños Limpiadores De Piel, 5 Paquetes De 10",247.990,0,0,0,N/A
"Cetaphil Toallitas Faciales Y Corporales, Paños De Limpiez.",161.990,0,0,0,N/A
Beaupretty 4pcs Cepillo De Limpieza Facial Facial Cepillo De,158.699,0,0,0,Beaupretty
"Neutrogena Toallita De Limpieza Facial Individual, Toallitas",88.079,0,0,0,Brand not found
Exfoliante X 2 Facial Celulosa ,9.341,15,0,0,10MILAZO
Pmd Clean - Dispositivo De Limpieza Facial Inteligente Con C,615.806,0,0,0,Pmd Beauty
Viaje Toalla Desechable De Limpieza Facial Toallita Papel,75.454,0,0,0,común (uso)
Paquete De 6 Esponjas Exfoliantes De Limpieza Facial De Lufa,98.231,0,0,0,A Miniature Sleigh
10 Toallitas Desmaquillantes Reutilizables,54.969,0,0,0,Genérica
"Limpiador Facial, Mini Spa Eléctrico 5 En 1",11.000,0,4.6,20,Brand not found
Cepillo Exfoliante Facial,22.000,0,4.1,9,GypsyMarket Co
Sauna Facial Vaporizador Limpieza Poros Puntos Negros,77.675,0,4.8,9,Benice
"Herramienta De Limpieza Facial Nooni Marshmallow Whip Maker,",111.725,0,0,0,Nooni
Sauna Facial Vaporizador Para Limpieza Facial,58.900,0,4.7,3,Osenjie
"8 Esponjas Faciales Coloridas Ovaladas De Limpieza Facial, E",117.876,0,0,0,Mollensiuer
Atomizador Vapor Limpieza Cara,29.900,0,0,0,Genérica
Toallitas De Limpieza Facial Para Piel Sensible De Burt&rsqu,166.025,0,0,0,Brand not found
50pcs Toallas De Limpieza Facial Desechables Toallitas De,53.106,0,0,0,Generic
Dispositivo De Limpieza Facial. Limpiador De Maquillaje Con,65.453,0,0,0,Generic
"Exfoliante Facial, Almohadilla De Limpieza Facial De Silicon",85.133,0,0,0,Mr Lion
"Lamazuna Toallitas Faciales De Limpieza Para Mujer, Juego De",126.811,0,0,0,Lamazuna
Sauna Facial Vaporizador Limpieza Prof - L A $49900,49.800,0,5.0,2,Osenjie
Jabón Facial Espumoso All About Clean De Clinique (ve,176.798,14,0,0,Clinique
"Agua Limpiadora Mixsoon Centella 10.14 Fl Oz/300 Ml, Facial.",177.225,0,0,0,Mixsoon
"Depurador Facial Del Silicón Del Cepillo De La Cara,",71.914,10,0,0,Other
"Dageda 2 Esponjas Faciales Konjac, Limpieza Profunda De Poro",117.876,0,0,0,DAGEDA
Exfoliante Espumoso Face Wash Neutrogena Para El Acné Sin Ac,109.088,14,0,0,Neutrogena
Extractor De Espinillas Puntos Negros Acne Limpieza Facial,49.990,0,0,0,Genérica
Vaporizador Facial Yl-882 Limpieza Profunda Hidratante,15.000,0,0,0,Genérica
"Esponjas De Limpieza Facial Naturales, 20 Esponjas Faciales",98.231,0,0,0,Fintozer
"Cepillo De Limpieza Profunda Para Poros Faciales, Manual, De",76.649,25,0,0,Genérica
Toalla Desechable Toalla De Limpieza Facial De Algodón Suave,81.827,0,0,0,Generic
"Limpiador Facial Limpiador Con Vitamina B5 X, Limpieza Profu",63.143,0,0,0,Generic
Máquina De Limpieza Profunda Facial Comedone Pimple Zit Extr,100.104,0,0,0,Generic
"Cepillo Snico De Limpieza Facial De Silicona, El Mejor Masaj",196.461,0,0,0,Microderm GLO
Cepillos De Limpieza Facial Sónicos Eléctricos Y Masajeador,67.267,3,0,0,Generic
Maquina Limpieza Facial Spa8en1,3.130.680,0,0,0,Vevor
"Hikin Cepillo De Limpieza Facial, Mango De Madera, Cerdas Na",97.991,0,0,0,Hikin
Vaporizador Hidratante Facial,79.900,0,0,0,Vaporizador Facial Aromaterapia Limpieza Belleza Facial
Toallitas Faciales | Toallitas De Limpieza Facial Con Vitami,108.663,0,0,0,Body Prescriptions
"Cepillo Exfoliador Facial De Silicona, Cepillo De Limpieza F",85.133,0,0,0,Luckyiren
Mini Microcorriente Calidad Facial Con Crema Facial Skin,132.986,0,0,0,Generic
Sauna Facial Vaporizador Limpieza Poros Puntos Negros Benice,70.460,0,4.5,2,Benice
Sauna Facial Digita Vaporizador Limpieza Poros Puntos Negros,68.900,0,0,0,Genérica
Humidificador De Vapor Caliente For La Limpieza Profunda De,164.915,0,0,0,Generic
Nuogo Paquete De 20 Cepillos De Limpieza Facial De Silicona,205.455,0,0,0,Nuogo
Bioderma - Limpiador Facial - Sébium - Limpiador Desmaquilla,170.381,0,0,0,Bioderma
Cepillo 5 En 1 Facial Limpieza Ex - Unidad a $19990,19.990,0,0,0,GN
Vaporizador Limpieza Piel Cara,74.900,0,0,0,Vaporizador Facial Aromaterapia Limpieza Belleza Facial
"Neutrogena Toallita De Limpieza Facial Individual, Toallita.",115.826,0,0,0,Neutrogena
"Gainwell 100 Esponjas Faciales Comprimidas, Limpieza, Para U",149.868,0,0,0,Gainwell
"Compatible Con Cabezales De Cepillo De Limpieza Facial, Cabe",171.340,0,0,0,Acosexy
Vaporizador Facial Sauna Spa Eléctrico Limpieza Rostro Poros,59.900,0,0,0,THY
2x Creme De Progesterona Para Mujeres En Equilibrio Con Men,75.233,5,5.0,1,Genérica
Agua Facial Pepino Natural Sant - mL a $33,16.500,0,0,0,Natural Sant
Jexcull - Paquete De 4 Cepillos De Limpieza Facial De Silico,80.698,0,0,0,JEXCULL
Cepillo De Limpieza Facial 3-1 ,22.900,0,0,0,Tedge
Toallitas Faciales Diarias Kirkland. Limpieza Suave Para Un ,126.456,0,0,0,Generic
"Toallita De Limpieza Facial Individual, Toallita.",87.990,0,0,0,Neutrogena
"Limpiador Facial, Mini Spa Eléctrico 5 En 1",11.000,0,4.6,20,Brand not found
Cepillo Exfoliante Facial,22.000,0,4.1,9,GypsyMarket Co
Piedra Pomez Estropajo Para Piel Cuerpo Baño Ducha Cuerda St,14.990,0,4.5,2,Piedra
Jabón Liquido Facial Para Piel Normal-seca Ana María *100 Gr,29.000,0,0,0,Ana Maria
Body Prescriptions Paquete De 2 Toallitas De Limpieza Facial,155.755,0,0,0,Toallitas
Cepillo De Limpieza Facial Sónico - Unidad a $41000,41.000,0,0,0,Brand not found
"Gerrii 960 Esponjas Faciales Comprimidas, Esponja De Limpiez",455.367,0,0,0,Gerrii
Sauna Spa Facial Limpieza,49.900,0,0,0,Osenjie
Sauna Facial Vaporizador Limpieza Profunda Rostro Spa Vapor,73.139,39,0,0,Osenjie
Cepillo Masajeador Limpieza Facial Corporal Pulpo Exfoliante,7.300,0,0,0,My Beauty Tool
Vaporizador Facial Limpieza Suaviza Rejuvenece Mascarilla ,91.900,0,0,0,Otras macas
Toallitas Faciales | Toallitas De Limpieza Facial De Árbol.,135.990,0,0,0,Body Prescriptions
Sensibio H2o Eye Desmaquillante Bifásico Ojos 125ml Bioderma,56.000,30,5.0,1,Bioderma
Effaclar Gel Purificante Microexfoliante - La Roche Posay,133.500,25,4.9,77,La Roche Posay
Solución Micelar 4 En 1 - Isdin 100 Ml,32.250,25,4.3,3,Isdin
Gel Limpiador Facial Piel Grasa Effaclar - La Roche Posay,133.500,25,4.9,69,La Roche Posay
"Solución Effaclar Ultra de La Roche-Posay, agua micelar, 200 ml",83.250,25,5.0,2,La Roche-Posay
Endocare Hydractive Agua Micelar 400 Ml,84.000,25,5.0,2,Endocare
Gel Limpiador Espumoso - Cerave 236 Ml,52.000,20,5.0,9,CeraVe
Pigmentbio H2o - Bioderma 250 Ml,77.700,30,4.8,5,Bioderma
Leche Limpiadora Avene Suavizante X 200ml,94.500,30,5.0,3,Avène
Agua Micelar Piel Mixta A Grasa - Uriage,71.250,25,5.0,3,Uriage
Endocare Hydractive Agua Micelar - Cantabria Labs 100 Ml,39.000,25,4.5,2,Endocare
Sébium Gel Moussant - Bioderma 500 Ml,129.500,30,5.0,19,Bioderma
Bioderma Agua Micelar Desmaquillante Sébium H2o - 500ml,116.900,30,4.6,23,Bioderma
Normaderm Gel Limpiador - Vichy 400 Ml Vichy,138.000,25,4.8,25,Vichy
Mini Agua Micelar Oleo Garnier,15.800,0,0,0,Garnier
Hyséac Gel Limpiador - Uriage,81.750,25,4.9,45,Uriage
Cleanance Barra Limpiadora - Avène 100 Gr,33.600,30,5.0,5,Avène
Sébium Gel Mousaant Actif - Bioderma 200 Ml,97.300,30,5.0,5,Bioderma
Pigmentbio Foaming Cream - Bioderma,101.500,30,4.7,15,Bioderma
Gel Limpiador Facial Piel Grasa Effaclar - La Roche Posay,103.500,25,4.5,8,La Roche Posay
Limpiador Masajedor 4 In 1 Electr - Unidad a $15000,60.000,0,4.7,9,Genérica
Cleanance Gel Limpiador - Avène - mL a $438,87.500,30,5.0,4,Avène
Dermopure Oil Control Gel Limpiador - Eucerin,70.500,25,4.7,125,Eucerin
Agua Micelar Skinactive Todo En 1 Facial Garnier 100ml Caba,9.800,0,5.0,1,Garnier
Spray De Limpieza Facial De Silicona 60 Ml,125.900,0,0,0,Brand not found
"Cepillo De Limpieza Facial Sónico, Dispositivo De Limpieza D",330.900,0,0,0,Brand not found
Pulpo Limpiador Facial Exfoliante Limpieza Facial,7.990,0,0,0,Brand not found
Fotoprotector Spray Wet Skin Pediatrics Spf50+ - Isdin 200 M,110.250,25,5.0,3,Isdin
Keracnyl Gel Limpiador - Ducray 400 Ml,109.900,30,5.0,1,Ducray
Cetaphil Pro Ac Espuma Limpiadora - Galderma,96.600,30,4.6,14,Cetaphil
Normaderm Gel Limpiador - Vichy,107.250,25,5.0,8,Vichy
Cepillo Para Limpieza Facial,90.900,0,0,0,Mcigicm
Dermopure Oil Control Exfoliante - Eucerin 100 Ml,73.500,25,4.8,14,Eucerin
Gel Gommante Exfoliante Facial - Uriage 50 Ml,49.500,25,5.0,1,Uriage
Gelclin Loción Limpiador Suave - Skindrug,75.000,0,5.0,3,Skindrug
Dermopan Barra Limpiadora - A-derma,30.100,30,5.0,1,A-Derma
Cetaphil Loción Limpiadora - Galderma,74.200,30,4.6,9,Cetaphil
Sébium Gel Moussant - Bioderma 200 Ml,81.200,30,4.8,4,Bioderma
"Limpiador Facial, Mini Spa Eléctrico 5 En 1",11.000,0,4.6,20,Brand not found
Cepillo Exfoliante Facial,22.000,0,4.1,9,GypsyMarket Co
Sébium Gel Moussant - Bioderma 100 Ml,49.000,30,4.8,10,Bioderma
Cepillo Masajeador Facial ,34.900,0,0,0,"Limpieza profunda y suave vibración ultra sónica que elimina eficazmente los residuos cosméticos, aceite y células muertas de la piel, acné y cabezas negras y disminuye los poros."
Sensibio Gel Moussant - Bioderma 100 Ml,48.975,25,4.9,129,Bioderma
Agua Micelar Garnier Desmaquillante Skin Active,32.700,18,0,0,Garnier
"Toalla Desmaquillante Homexcel 6 Piezas, Suave Y Rápido Seca",87.900,0,0,0,Homexcel
"Gel - Betadine Skin Cleanser, 4 Ounces, Antiseptic Hand Wash",140.000,0,0,0,Betadine
Vaporizador Facial 3 En 1 Con Lámpara De Aumento 5x Caliente,798.990,0,0,0,GORXZC
Oil Free Clear Wash Gel Limpiador Facial - Neutrogena 177 Ml,44.800,20,4.3,16,Neutrogena
Oil Free Eye Makeup Remover - Neutrogena 162 Ml,44.800,20,4.8,12,Neutrogena
 ,0,0,0,0,
Cepillo Facial Para Limpieza Profunda Y Eliminación De Punto,100.000,0,0,0,Lasenersm
Cepillo De Limpieza Facial Girat - Unidad a $176900,176.900,0,0,0,COSLUS
Humidificador Facial Pulverizador De Niebla Facial Recargabl,15.080,48,0,0,Ruffo
Rueditas Faciales Desmaquillar,63.600,0,5.0,1,Pomys
Agua Micelar Cara Contorno Limpieza Facial Desmaquillante,14.670,10,0,0,Delia Cosmetics
Agua Micelar Desmaquillante Limpieza Facial Rostro Ojos,13.320,10,0,0,Delia
 Vaporizador Facial Portátil Limpiador Spa Sauna,38.000,0,0,0,Osenjie
Vaporizador Limpieza Sauna Cara,79.900,0,0,0,Vaporizador Facial Aromaterapia Limpieza Belleza Facial
Kit Vapor Facial 7 Herramientas Limpieza Profunda Piel,320.990,0,0,0,Pjordo
Vaporizador Facial Profesional Para Limpieza Profunda,659.990,0,0,0,Dress Vous
Cepillo Facial De Silicona Para Limpieza Profunda - Pack De ,99.000,0,0,0,Hinzic
Cepillo Limpieza Facial Recarga,24.000,0,0,0,Genérica
"Beautyfrizz Toallitas De Limpieza Facial De Lavanda, 120 Un.",163.307,3,0,0,Beautyfrizz
"Agua Micelar Garnier Con Ácido Hialurónico, Limpieza Facial.",213.800,0,0,0,Garnier
"Toallitas Faciales Desmaquillantes Suaves Cetaphil, Limpieza",118.650,0,0,0,Cetaphil
Kit Para Extraer Retirar Espinillas Acné - g a $167,17.000,15,0,0,Taogneijen
10 Esponjas Faciales Para La Limpieza Diaria Exfoliante Faci,138.340,0,0,0,Lallisa
Máquina De Masaje Facial De Microcorriente Para Refinamiento,115.638,0,0,0,Generic
"Neutrogena Toallitas De Limpieza Facial Desmaquillantes, To.",196.644,0,0,0,Neutrogena
Esponja Konjac Sponge Wash Puff Para Maquillaje Facial Hemis,57.531,0,0,0,Genérica
Vaporizador Facial De Ozono Para Limpieza Profunda,899.990,0,0,0,Hurrise
Cepillo De Limpieza Facial De Silicona Genérico Ice Face Rol,96.784,0,0,0,GeeRic
Sauna Facial Vaporizador Limpieza Rostro Poros Puntos Negros,79.990,0,0,0,Brand not found
Cepillo De Limpieza Facial Cepillo De Ducha Eléctrico Multif,113.115,0,0,0,Genérica
Sauna Facial Vaporizador Limpieza Rostro Puntos Negros ,49.900,0,5.0,1,vaporizador
Sauna Facial Digita Vaporizador Limpieza Poros Puntos Negros,107.120,0,0,0,sauna facial benice
Jabon Para Piel  Con Aloe+manzanilla+miel Y Calen,34.000,0,0,0,Laboratorio Medick
"Cepillo Para Polvo De Limpieza Facial, Doble Cara Limpia Y E",148.119,0,0,0,Sonew
Cepillo Limpieza Facial Corporal Pulpo Exfoliante,14.900,0,0,0,Impor González
Fast Beauty Co Go - Toallitas De Limpieza Facial Micelar Par,80.225,0,0,0,Chloe cosmetics
"Limpiador Ultrasónico Facial, Limpieza Facial Profunda",44.900,0,0,0,Genérica
"Burt's Bees - Toallitas Faciales, Limpieza Facial, Removedo.",74.990,0,0,0,Burt's Bees
"Cepillo De Limpieza Facial, Cepillos Para Bajos, Paquete De",199.147,0,0,0,Bass Brushes
Peeling Urtasonico Paleta Limpiez - Unidad a $85000,85.000,0,0,0,Beuaty star
Kit Limpieza Facial ,18.615,15,0,0,B & L
Esponja De Limpieza Facial X12,11.543,3,5.0,1,Hivey
Esponjas Faciales Naturales Comprimidas Para Limpieza 50 Pcs,54.035,14,5.0,1,Genérica
Set De Cepillos Faciales Clsevxy - Exfoliación Y Limpieza,167.900,0,0,0,Clsevxy
"Limpiador Facial, Mini Spa Eléctrico 5 En 1",11.000,0,4.6,20,Brand not found
Cepillo Exfoliante Facial,22.000,0,4.1,9,GypsyMarket Co
"Cepillo De Limpieza Facial, Cepillo Con Cuerda Para Colgar.",47.378,14,0,0,Other
Limpiadora Facial Espuma 150ml,32.900,0,5.0,2,Cosmenatural
"Cepillo De Limpieza Facial, 6 En 1 Fregador Facial Eléctrico",206.900,0,0,0,Atidie
"Esponjas De Limpieza Facial, Pulpa De Madera, 50 Pcs",56.209,12,0,0,Other
2 Paquete De 2-4 Cepillos Faciales De Silicona Con 2 Piezas,85.279,14,0,0,Other
"Esencia Reductora De Polipéptido De Ginseng, 100 Ml",57.044,0,0,0,Genérica
Masajeador Limpieza Facial X2 Unidades Pulpo Exfoliante,4.900,0,0,0,Genérica
"Toallitas De Limpieza Facial Desmaquillantes, To.",256.990,0,0,0,Neutrogena
Desmaquillante Piel Sensible   ,38.900,0,0,0,Liquido Desmaquillante  Limpieza Facial
"Cepillo De Limpieza Facial, Estropajo Facial Giratorio Shinc",130.900,0,0,0,Shinchie
Vaporizador Facial Kit Spa Humidificador Forma Astronauta,268.990,0,0,0,Iebilif
Humidificador Facial Vaporizador Para Limpieza De La Piel,198.990,0,0,0,Phhasxyle
/ Pastillas De Esponja De Limpieza De Cara Ronda Amarillo,56.159,0,0,0,Generic
Vaporizador Facial 3 En 1 Limpieza Profunda Con Lámpara 5x,1.066.990,0,0,0,Varipowder
Cicatricure Agua Micelar Limpiadora Facial Todo En 1,62.930,21,0,0,Cicatricure
"Cepillo Exfoliante Facial, Lavado A Mano, Limpieza Suave Y P",53.106,41,0,0,Generic
Cepillo De Limpieza Facial,173.578,0,0,0,Brand not found
"Cabezal De Cepillo De Limpieza Facial, Cabezales De Cepillo",126.811,0,0,0,Serhii Burlia
Cepillo Facial Limpieza Sonic 2 En 1,39.900,0,0,0,GN
Cepillo Limpieza Facial Eléctrico Usb + Caja Personalizada,65.700,0,0,0,Water Ice Levin
Cepillo De Limpieza Facial Ecotools Mini Con Cítricos Vegano,119.488,0,0,0,Ecotools
Limpieza Facial - Shiseido Complete Cleansing Microfoam Clea,297.000,0,0,0,Shiseido
Cepillo De Limpieza Facial,65.000,0,0,0,Facial cleansing brush
Juego De Cepillos Giratorios De Limpieza Facial Recarga...,197.900,0,0,0,Brand not found
 Lo Más Nuevo 2021  Cepillo De Limpieza Facial: Juego ...,167.900,0,0,0,Gackoko
Cepillo De Limpieza Facial Hecho Con Silicona Suave Ult...,211.900,0,0,0,Ezbasics
5 Paquete De 5-6 Cepillos Faciales De Silicona Con 5 Piezas,51.690,13,0,0,Other
"Cepillo De Limpieza Facial, Cepillo Facial Recargable A...",189.900,0,0,0,Brand not found
Máquina De Masaje Facial De Microcorriente 1u Para Refinamie,126.701,0,0,0,"electroporador facial,electroporador,masajeador facial"
Válvula De Rociado De Pre Limpieza Cabezal De Rociador...,289.900,0,0,0,Jzbrain
Facial Limpieza Puntos Negros,53.800,0,0,0,uan pixel
Cepillo De Limpieza Facial De Silicona Exfoliante Facial,105.769,3,0,0,Generic
"Esponja Konjac, 100 Unidades, Limpieza Profunda Para Niñas",101.954,28,0,0,Genérica
"Konjac - Esponjas Faciales Para Limpieza Y Exfoliacion, Espo",103.755,0,0,0,Dys Farm
"Yoni Hierbas Para Limpieza (20 Bolsas), Hierbas V Para Vapor",109.519,0,0,0,Exjiota
Limpieza Facial Desmaquillante L'oreal Paris Revitalift...,152.591,0,0,0,L'Oréal Paris
"Aceite De Limpieza Profunda Dhc, Aceite De Limpieza Facial,",264.644,0,0,0,DHC
"Cepillo De Limpieza Facial De Silicona, Almohadilla De",112.009,3,0,0,Generic
"120 Esponjas Faciales Comprimidas, Esponja De Limpieza Facia",126.811,0,0,0,WORFACE
Sistema De Limpieza Facial Ulta Beauty Advanced Con Cepillos,153.206,10,0,0,Ulta Beauty
"Dispositivo De Limpieza Facial Pmd Clean, Cepillo De Silicon",577.525,10,0,0,Pmd Beauty
Recambio De Cabezal De Cepillo De Limpieza Facial Clarisonic,303.891,0,0,0,Clarisonic
Cepillo De Limpieza Facial Manual Con Forma De Garra De,103.169,0,0,0,Generic
Cepillo Eléctrico De Limpieza Facial Para Masaje De 3 Cabeza,221.761,32,0,0,Generic
"Toallitas Faciales Desmaquillantes Suaves Cetaphil, Limpieza",133.650,0,0,0,Cetaphil
"Agua Micelar Garnier Con Ácido Hialurónico, Limpieza Facial.",210.800,0,0,0,Garnier
"Toallitas Faciales Desmaquillantes Suaves Cetaphil, Limpieza",130.650,0,0,0,Cetaphil
Z Cepillo De Limpieza Facial De Silicona Recargable,151.971,0,0,0,Generic
"Limpiador Facial, Mini Spa Eléctrico 5 En 1",11.000,0,4.6,20,Brand not found
Cepillo Exfoliante Facial,22.000,0,4.1,9,GypsyMarket Co
* Limpiadora Facial Eléctrica Re - Unidad a $146563,152.945,0,0,0,Generic
Exfoliante Facial Barbershop,34.990,0,0,0,Barber Shop
"Taza De Espuma Para Lavado De Cara, Crema Rica, Fabricante",135.875,0,0,0,Generic
Cepillo De Limpieza Facial Y Masajeador Facial Foreo Luna 4,1.108.310,0,0,0,Foreo
Cepillo De Limpieza Facial De Silicona Exfoliante Facial,97.184,3,0,0,Generic
Cepillo Facial Recargable De Silicona Eléctrica Para Limpiez,280.544,27,0,0,Generic
Cepillo De Limpieza Facial Foreo Luna Fofo Smart Skin Analyz,338.906,10,0,0,Foreo
"Limpiador Cítrico C&c, Paquete De 2, Doble Uso",120.373,14,0,0,Clean & Clear
 ,0,0,0,0,
"Cepillo Facial De Madera Para Limpieza Facial, Mango De Haya",53.344,44,0,0,Generic
Terapia Vapor Sauna Facial Olla,74.900,0,0,0,Vaporizador Facial Aromaterapia Limpieza Belleza Facial
Juego De Cepillos Giratorios De Limpieza Facial Recargables ,195.827,0,0,0,Clsevxy
"Toallitas Desmaquillantes Micelares Leafality, Tamaño Extra ",150.000,0,0,0,Leafality
"Cepillo De Limpieza Facial Orauley Recargable, 1200mah",215.470,0,0,0,Orauley
Herramienta De Limpieza Facial Beautybio Glofacial Hydro-inf,1.555.209,0,0,0,Beautybio
Cepillo De Limpieza Facial Para Mujeres Cepillo Exfoliante F,70.460,2,0,0,Brand not found
"Dispositivo De Limpieza Facial Pmd Clean, Cepillo De Silicon",576.500,0,0,0,Pmd Beauty
Limpiadora Facial Eléctrica Reca - Unidad a $148217,154.671,0,0,0,Generic
