product_name,price,discount,review_rating,review_amount,brand
"Limpiador Facial, Mini Spa Eléctrico 5 En 1",11.000,0,4.6,20,Brand not found
Cepillo Exfoliante Facial,22.000,0,4.1,9,GypsyMarket Co
Cepillo Limpiador Facial 5 En 1 Masajeador Exfoliante A Pila,23.183,3,0,0,Univex
Agua Micelar Kiss Beauty 220ml,13.150,0,0,0,Kiss Beauty
Parches Desintoxicantes 100und,68.310,31,0,0,Kinoki
Limpiador Espátula Ultrasonido ,29.900,0,0,0,Muye
Masajeador Facial 4en1 Cnaier  ,60.000,0,0,0,Cnaier
Parche Desintoxicantes 50und - Unidad a $974,47.187,37,0,0,Kinoki
Rueditas Desmaquilladoras Pomys,36.867,0,0,0,Familia
Parche Desintoxicantes 50und - ,17.000,0,0,0,Kinoki
Spa Facial Mini Masajeador Facial - Unidad a $10000,10.000,0,0,0,Genérica
Desmaquillador Dual Samy 260 Ml - Ml A $100,38.000,0,0,0,Samy
Maquina De Limpieza Facial 5 En 1,13.900,0,0,0,Genérica
Hyséac Gel Limpiador - Uriage,129.750,25,0,0,Uriage
Agua micelar Garnier skinactive  400ml,33.900,0,0,0,Garnier
Masajeador Limpieza Facial Pulpo Exfoliante Espuma Portátil ,8.500,0,0,0,Etude House
Sensyses Cleanser Sebum Desmaquillante Limpiador Sesderma,65.250,25,0,0,Sesderma
Masajeador Facial Exfoliante ,9.900,0,0,0,Genérica
Limpiador Anti-rugosidades - Cerave 236 Gr,55.200,20,0,0,CeraVe
Pomo Desmaquillante En Toallitas De Atenea - G,22.900,0,0,0,Atenea
Masajeador Limpieza Facial Pulpo Exfoliante Cepillo,6.305,3,0,0,Etude House
Agua Micelar Hidratante,24.590,0,0,0,L'Oréal Paris
Locion Despigmentadora - mL a $267,16.000,0,0,0,Despigmentadora
Desmaquillador Essential para ojos y rostro Lbel 45ml,24.380,8,0,0,L'Bel
Kit Masajeador Facial Lim 12 Pz,29.900,0,0,0,Genérica
Levantamiento Facial Con Microcorriente Color Rosa,163.123,2,0,0,skindion Levantamiento Facial Con Microcorriente Color Rosa
Agua Micelar Bifásica Facial Skin First Cyzone,9.000,0,0,0,Cyzone
Samy Agua Micelar Desmaquillante  260ml - Ml A $50,15.500,0,0,0,Samy
Sensyses cleanser hyaluronic Sesderma 200 ml,65.250,25,0,0,Sesderma
 Limpiador Masajedor 4 In 1 Electric Recargable Facial,55.900,0,0,0,Cnaier
Limpiador Facial Ultrasónico - Kg a $28311,28.311,0,0,0,pala facial
Cetaphil Limpiador Piel Grasa - Galderma,53.900,30,0,0,Cetaphil
Sensibio H2o Toallitas Desmaquillantes - Bioderma,39.900,0,0,0,Bioderma
Vaporizador Facial Vick,83.000,0,0,0,Vick
Agua Micelar Limpiadora Facial 3 En 1 Vitamina E 300ml,12.900,0,0,0,Avon
Limpiador Exfoliante Facial Rebel Skin Sonic Cleanser,39.900,0,4.9,8,Rebel
Pulpo Limpiador Facial Exfoliante Limpieza Facial,7.990,0,0,0,Brand not found
Pomos Desmaquillantes En Algodón Almohadil - g,19.900,0,0,0,Fluffs
Desmaquillante Bifásico Waterproof Para Ojos 100 Ml Uriage,57.750,25,0,0,Uriage
Pond's Desmaquillante Clarant B3,47.000,0,0,0,Pond's
Cepillo Exfoliante Facial Limpiador Poros Masajeador 2801,15.900,0,0,0,Genérica
Limpiador Masajedor  Facial Mini Spa Electrico 5 En 1  Caja ,13.900,0,0,0,Brand not found
"Bioderma Sébium H2o, Limpieza Profunda, 250 Ml",66.276,26,0,0,Bioderma
Agua Micelar Kaloe 125ml - mL,14.475,0,0,0,Kaloe
Desintoxicador Spa Detox Limpiador Ionico Dual Baño De Pies ,1.109.900,0,0,0,Beauty
5 In 1 Beauty Care Massager - - Unidad,13.205,5,0,0,Compra y Más
Agua Micelar Pili 220 - Ml,19.800,0,0,0,Pili
Toallitas Desmaquillantes Neutrogena® Night Calming X 25 Un.,39.850,0,0,0,Neutrogena
Dispositivo Estiramiento Facial Lifting Estirador Cara Usb,59.750,5,3.5,15,Genérica
Cepillo Limpiador Facial Exfoliante Y Masajeador De Pulpo,4.900,0,5.0,3,Brand not found
"Limpiador Facial, Mini Spa Eléctrico 5 En 1",11.000,0,4.6,20,Brand not found
Cepillo Exfoliante Facial,22.000,0,4.1,9,GypsyMarket Co
Hidraven Crema Espumosa Sin Jabón - Sesderma 300 Ml,93.750,25,4.8,24,Sesderma
Esponja Facial Celulosa Comprim,7.895,30,4.9,9,Huini
Limpiador Multisensorial Dhems - mL,54.300,0,0,0,Dhems
"Korean Biodance Bio-collagen Real Deep Mask, Biodance",57.797,9,0,0,Tairashop
Sensilis Gentle Cleansing Mousse - Sensilis 200 Ml,75.750,25,4.8,8,Sensilis
Sensibio Gel Moussant - Bioderma,129.500,30,5.0,21,Bioderma
Equipo Limpieza Facial 5 En 1 Mini - Unidad a $1570,10.990,0,0,0,Visofo
Locion Lactibon  - Medihealth - mL a $632,75.900,0,0,0,Medihealth
Desmaquillante Espectañas - mL,43.290,0,0,0,Espectañas
Pomo Cepillo Limpiador Facial Exfoliante En Silicona Pequeño,6.900,0,5.0,1,Brand not found
2 Unidades De Aceite De Batana Útil Para La Salud Del Cabell,51.734,7,4.6,11,Generic
Isdinceutics Essential Cleansing - Isdin 200 Ml,90.750,25,4.9,34,Isdin
Esponja De Limpieza Facial Comprimi - Unidad a $948,5.690,0,4.0,8,Nuogo
"Limpiador Ultrasónico, Peeling",108.000,10,0,0,Jomarto
Effaclar Barra - La Roche Posay,39.750,25,4.9,31,La Roche Posay
Vaporizador facial Mini Nano para limpieza de la piel y maquillaje rosa,19.740,40,0,0,Nano
Desmaquillante Neutrogena S Acei Spray 16,60.100,0,0,0,Neutrogena
Cepillo Masaje Limpieza Facial,21.798,12,0,0,Limpieza profunda y suave vibración ultra sónica.
Desintoxicador Spa Detox Limpiador Ionico Dual Baño De Pies,1.109.990,0,0,0,Desintoxicador Ionico Dual
Garnier Agua Micelar Todo En 1 ,32.900,0,0,0,Garnier
Biretix Cleanser Gel Limpiador Purificante - Cantabria Labs ,83.250,25,0,0,Cantabria Labs
Cepillo De Limpieza Facial 2en1 - Unidad a $12000,12.000,0,4.0,1,Miis Cosmetics
Cepillo Exfoliante Manual Limpieza De Cara Impurezas,10.900,0,0,0,Mazugi
Make Up Eraser Toalla Desmaquillante Mejor Calidad Full,14.000,0,5.0,1,Make Up
Loción Despigmentante Morada - mL a $367,22.000,0,4.7,23,QUEENS SKIN
Nihay Dispositivo De Estiramiento Facial Con Microcorriente Color Segun Disponibilidad,29.800,0,0,0,Nihay
Toalla Desmaquillante Salon Expert Purpura X 1 Und Color Multicolor,14.900,0,4.0,1,Salon expert
Limpiador Facial Miniluna2 Negr - Unidad a $11250,11.250,0,5.0,4,Genérica
Cepillo Exfoliante Facial Limpiad - Unidad a $11609,11.609,0,0,0,Brand not found
Gel Limpiador Dhems 200 Ml,40.950,30,5.0,6,Dhems
Esponjas Faciales De Celulosa Compri - Unidad a $56,8.000,0,0,0,Luxiv
Vaso Vapor Ozono De Pedestal,28.600,0,4.4,8,Beautyeyestore
Limpiador Espátula Ultrasonido ,30.900,0,2.7,3,Genérica
Masajeador Facial 5 En 1 Spa,31.900,0,0,0,Genérica
Cinturón Ciática Soporte Aliviar Dolor Espalda Mujer Hombre,60.440,7,0,0,Genérica
Vaporizador Facial Recargable,13.900,0,0,0,Nano Spray Water YL882
Acid Mantle® Prob5 Limpieza Delicada Gel Facial,38.900,26,4.9,14,Acid Mantle
Limpiador Espátula Ultrasonido - Unidad a $5940,29.700,0,4.0,1,Muye
Piel Grasa Rutina Eucerin,173.340,40,5.0,2,Eucerin
Molde De Limpieza Facial Hielo ,17.900,0,4.5,2,Genérica
Toallitas Desmaquillantes Lea,13.650,22,0,0,Lea
Neotone Gel Limpiador - Isispharma 150 Ml,83.300,30,5.0,6,Isispharma
Agua Micelar Smart 3b X 260 Ml - mL,14.089,0,0,0,Smart
Foreo Limpiador Masajeador Faci,14.900,0,0,0,Genérica
Agua micelar revitalizante Renew - 150 ml Avon,11.990,0,0,0,Avon
Cepillo Delimpieza Facial 5en1,17.900,0,4.0,1,Genérica
Agua Micelar 220ml - L,24.651,0,0,0,Kosmaderm
4 Unidades De Crema De Colágeno Joint Bone Meridian,56.646,27,4.3,37,Genérica
"Limpiador Facial, Mini Spa Eléctrico 5 En 1",11.000,0,4.6,20,Brand not found
Cepillo Exfoliante Facial,22.000,0,4.1,9,GypsyMarket Co
Dermapen Derma Dr Pen Ultima A1- - Unidad a $147900,147.900,12,5.0,1,Dr. Pen Dermapen
Oferta Pañuelo Familia Triple Hoja Bolsillo Pague 4 Lleve 6,6.000,0,5.0,1,Familia
Mini Cepillo Electrico Limpieza - Unidad a $71100,71.100,0,0,0,SONIC FACIAL
Jabón Liquido Detox Asepxia® - mL a $136,27.200,0,4.6,8,Asepxia
Desmaquillante Bifásico Ojos Y Labios D - Ml A $410,36.015,30,0,0,Dhems
Exfoliante Limpiador Facial - Unidad a $11800,11.800,0,5.0,1,Vivalizz
Vapor Ozono Facial / Corporal Calor Y Frió 2 Brazos Pedestal,392.500,0,4.7,23,Beautyeyes
Agua Micelar Reparadora Nivea Regenerating Micellar Water 40,30.900,0,0,0,Nivea
Cepillo Aseo Facial Gel Sílice - Unidad a $19440,19.440,10,0,0,Harko
Esponja Facial Celulosa Comprim - Unidad a $908,10.900,0,4.3,9,Huini
"Limpiador Ultrasónico, Peeling ",110.400,8,5.0,6,Brand not found
Papel Higienico Humedo Familia Aloe Vera X 100und,15.300,0,4.9,9,Familia
Espuma Limpiadora Avene 150 Ml - mL a $556,83.356,30,4.7,11,Avène
Cepillo Eco Bamboo Limpieza Facial Belleza Cuidado Personal,30.900,0,5.0,1,Genérica
Cepillo Limpiador Facial Suave,23.500,0,0,0,Gypsy Market Co
Vapor Ozono Facial/capilar 2en1,239.850,0,5.0,3,Genérica
Parches Desintoxicantes X10und Limpiador Antitoxinas Detox  ,12.500,0,4.2,211,Genérica
Almohadillas De Algodón  Circulos Desmaquillantes X 100,19.900,0,4.0,1,Fluffs
Pomys Rueditas Faciales Algodón 300 Uni - mL a $139,41.800,0,4.6,10,Pomys
Desmaquillante Balsamo Hidratan - g a $212,21.243,3,4.8,37,Kiss Beauty
Pulpo Limpiador Facial Exfoliante ,7.990,0,0,0,Shoshi shop
Masajeador Facial Eléctrico Limpiador 12 En 1,29.900,0,0,0,Brand not found
Parche Desintoxicantes 20und - Unidad a $1121,22.425,25,4.6,15,Kinoki
Vaporizador Facial Nano Mist Portatil Pulverizacion Spray,11.900,0,4.2,47,Medellín Electrónica
Eucerin Agua Micelar Hidratante - Ml,81.600,20,0,0,Eucerin
Esponja Limpiadora Facial  X 5,58.692,16,0,0,KONJAC SPONGE
Limpiador Facial Ultrasónico - Unidad a $95220,95.220,10,5.0,6,Genérica
"Pastillas Esponja Facial, Limpi - Unidad a $73",10.500,40,5.0,5,Genérica
Kit Vaporizador+extractor+crema,91.700,0,0,0,Beautyeyes
"A Gomitas Goli De Ashwagandha Y Vitamina D, 60 Unidades 1pcs",64.346,3,5.0,3,Generic
Sauna Facial Digita Vaporizador Limpieza Poros Puntos Negros,69.900,0,4.8,54,Benice
Limpieza Facial Pulpo Exfoliante M - Unidad a $2990,2.990,62,0,0,Genérico
Mini Luna Masajeador Facial Limpiador Exfoliante Recargable ,13.900,0,5.0,8,Genérica
Papeletas Anti Grasa Facial - Unidad a $137,13.730,7,5.0,3,Papelitos Elimina Grasa Piel Facial
Parche Desintoxicantes 20und - ,11.900,0,5.0,1,Kinoki
Limpiadora Hidratante - Cerave 473 Ml,78.400,20,4.9,17,CeraVe
Cepillo Limpiador Facial Silicona - Unidad a $7000,7.000,0,0,0,connert
Serum Anti Acne Acid Salicilico,7.900,0,5.0,3,Bioaqua
Limpiador Facial Rejuvenecedor - Unidad a $105800,95.220,10,5.0,1,Genérica
"Botellas De Viaje Mujer, Kit Viajero, 11 Pcs Contenedores",22.900,0,4.0,1,Genérica
"Gomitas Goli De Ashwagandha Y Vitamina D, 60 Unidades,mezcl",67.931,0,5.0,6,General
Toallitas Desmaquillantes Nivea Agua De Rosas X 25und,33.450,0,5.0,1,Nivea
Limpiador Facial Exfoliante Masajeador Luna Mini Recargable,15.900,0,4.2,13,Forever
Nivea Agua Micelar 400ml,29.050,0,0,0,Nivea
"Cepillo De Limpieza Facial Forever Luna Mini 2, Exfoliación ",35.000,0,4.7,3,Forever
"Glowskins Mascarilla Nocturna De Colágeno,",67.444,4,5.0,3,Generic
Esponja + Pulpito Limpia Facial - Unidad a $17098,16.585,3,0,0,Trendy
Desmaquillante individual - Neutrogena,60.000,0,0,0,Neutrogena
"Limpiador Facial, Mini Spa Eléctrico 5 En 1",11.000,0,4.6,20,Brand not found
Cepillo Exfoliante Facial,22.000,0,4.1,9,GypsyMarket Co
Masajeador Limpieza Ultrasonico,34.190,5,0,0,Genérica
Desmaquillante bifásico L'bel Essential Detox 125 ml,30.000,0,0,0,L'Bel
Cepillo De Limpieza Facial 5 En 1 Masajeador Eléctrico,23.183,3,0,0,Osiris online
Vapor Ozono Profesional 3  En 1,407.915,15,4.6,9,Genérico
Tocobo Calamine Pore Control Cleansing Oil 6.8 Fl Oz / 6.76,120.000,0,0,0,Tocobo
Parche Desintoxicantes-  10 Und,10.450,5,3.7,3,TLBO
Dispositivo Estiramiento Facial Cara Antiarrugas Mujer,69.195,0,0,0,Genérica
Set De Herramientas Faciales Rena Chris Gua Sha & Face Rolle,175.249,9,0,0,Rena Chris
Cepillo Limpieza Y Exfoliante Facial - Silicona Suave ,12.950,50,0,0,Innerneed
Gel De Aloe Vera Penkaloe,59.900,0,5.0,5,Gea Beauty Company
Agua Micelar 240 Gr Funat - G A $83,19.900,0,0,0,Funat
Almohadillas Desmaquillantes Paños De Algodón Desmaquillarse,19.236,13,0,0,Importado TM
Cepillo Limpieza Facial Profund,95.940,40,0,0,Benton
Electroterapia  Alta Frecuencia Masaje Acné Suave Peine,123.834,0,0,0,Generic
La Crema Para Eliminar Verrugas W Elimina Rápidamente Color Blanco,53.907,0,0,0,Genérica
Vapor De Ozono Lampara Lupa Led,480.000,0,5.0,1,CORMEGA
Vapor Ozono Facial Y Capilar,230.000,0,4.0,5,Purare Technologic
X3 Despigmentante Morado Gotero - mL a $389,70.000,0,4.8,12,Queens
Limpiador Facial Rodillo - Kg a $19350,19.350,10,0,0,JDAG
5 In 1 Beauty Care Brush Massager Scrubberel ,12.890,0,4.3,111,Brand not found
Bioderma Agua Micelar Desmaquillante Sébium Piel Grasa 100ml,59.900,0,5.0,1,Bioderma
Nivea Agua Micellar Efecto Mate Piel Grasa X 400 Ml,23.900,22,4.4,5,Nivea
Toallas Húmedas Sprainer,71.950,0,5.0,7,Sprainer
Cepillo Limpieza Facial Pulpo - Kg a $5000,5.000,0,5.0,1,My Beauty Tool
Masajeador Facial 12 En 1 Exfolia - Unidad a $32100,32.100,0,4.8,23,Cnaier
Teen Derm Gel Sensitive - Isis Pharma 250 Ml,102.900,30,5.0,6,Isispharma
"Máscara De Colágeno Rosemine, Máscara Nocturna De Colágeno",73.153,13,5.0,1,Rose Mine
. Medicube Mascarilla Collagen Night Mask Wrapping Peel Of,57.531,13,4.7,3,Generic
Nivea Leche Y Tónico Micelar Agua De Rosas Piel Seca 200 Ml,43.100,0,5.0,5,Nivea
Cepillo Limpieza Facial Corpora,14.900,0,0,0,Impor González
Kit Masajeador Facial Lim 12 Pz,33.900,0,3.4,18,Genérica
Sebionex Foaming Gel - Acm,96.000,25,4.8,10,ACM
Agua De Rosas Por Litro X1000ml - L a $9900,9.900,0,4.9,8,Athos
Pulpo Y Cepillo Limpieza Facial,35.000,0,0,0,Rubyface
Cinturilla Faja Ciatica Lumbar Soporte Maternidad Pelvico,52.136,42,4.0,5,Genérica
Limpiador Facial Espinillas Puntos Negros Recargable Mny-582,27.700,0,2.7,3,Genérica
Vapor Ozono 2 Brazos Y Lámpara ,503.600,0,3.7,3,Brand not found
Agua Micelar Eucerin Dermopure - mL a $425,85.000,0,5.0,1,Eucerin
Precio Especial Pañuelo Familia Triple Hoja X 2 Cubos X 60un,11.250,0,5.0,2,Familia
Cepillo Masajeador 2 En 1 + Diadema Set Limpieza Mo0374,23.900,0,0,0,Genérica
Almohadilla Desmaquillante X100 - Kg a $1,9.800,0,5.0,3,Genérica
Vapor Ozono Pedestal Facial Sau,439.900,0,4.6,20,pedestal
Spa Facial Mini Masajeador Electrico Para La Cara 5 En 1,25.077,0,4.1,38,Brand not found
Gel Removedor De Puntos Negros Antisef 150 Gr,15.800,61,4.3,7,Brand not found
Limpiador Facial Rodillo - Kg a $20340,20.340,10,0,0,JDAG
Parche Desintoxicantes 10und - Unidad a $7000,7.000,0,5.0,1,Tor Technology
Toalla Desmaquillante Lavable - g,14.500,0,4.7,3,Abrigados
Repuesto Agua Micelar Chronos Natura,22.542,22,0,0,Natura
"Limpiador Facial, Mini Spa Eléctrico 5 En 1",11.000,0,4.6,20,Brand not found
Cepillo Exfoliante Facial,22.000,0,4.1,9,GypsyMarket Co
Repuesto Agua Micelar Chronos Natura,22.542,22,0,0,Natura
Vaporizador Facial Y De Ropa De Mano 4 En 1 Electrico Portat,46.123,23,4.8,11,Facial Steamer
Sauna Vaporizador Facial Profesional A506 Rejuvenecedor,69.900,0,4.7,16,Benice
Vapor Ozono Profesional Calor ,385.350,0,5.0,2,Genérica
Masajeador Facial Eléctrico Inalámbrico 12 En 1 Exfoliante ,34.900,0,4.7,3,CNAIR
"Cepillo De Limpieza Facial Para Cuidado Facial, Maquillaje Y",54.832,0,0,0,Generic
True You Jabón Líquido Facial True You Piel Grasa 150ml,34.900,0,0,0,True You
"12 Máscara De Colágeno Biodance,máscara Nocturna De Colágeno",123.696,0,5.0,1,Génerico
Agua Micelar Limpiadora Burt's Bees Coco Y Loto,59.900,33,0,0,Burt's Bees
Masajeador Limpieza Facial Gatico - Unidad a $9800,9.800,0,0,0,Trendy
Limpiador Masajedor  Facial Mini - Unidad a $14900,14.900,0,4.3,3,Brand not found
Vapor Facial Ozono Portatil,210.000,0,5.0,2,Steam
Rodillo Antigrasa Volcanico Pie,13.900,0,4.3,3,Lechapu
Vaporizador Facial Sauna Limpie,39.900,0,4.5,17,Osenjie
Cepillo De Limpieza Facial Foreo Luna 3 Sensitive Skin,1.690.533,0,0,0,Foreo
Extractor Limpiador Facial Puntos Negros Digital Recargable,65.100,0,0,0,GN
Parche Desintoxicantes 30und - ,13.900,0,5.0,3,Kinoki
3×gotas Paraojos Que Ayudan A Aliviar Los Síntomas Del B,77.490,0,0,0,Generic
Pomos Desmaquillantes En Algodón Almohadil - g a $6,15.900,0,4.0,1,PELUSAS
Mini Cepillo El Limpieza Facial - Kg a $399,49.900,0,0,0,Brand not found
Cepillo Limpieza Facial 3 En 1 Color Blanco,26.600,0,0,0,Cepillo Facial
Parche Hidratante Para Ojos  De Arroz ,13.350,0,4.5,2,Genérica
Parche Desintoxicantes 60und - - Unidad a $1233,64.900,0,4.7,3,Kinoki
Pañuelos Familia Triple Hoja Caja Pequeña Pague 2 Lleve 3,11.700,0,0,0,Familia
Pulpo Exfoliante Limpiador - Un,8.000,0,0,0,Etude House
Parche Para Dejar De Fumar Con 60 Extractos De Plantas Fs7,99.131,19,0,0,Sefudun
Cepillo Ducha Baño Bebe  X 2 Unidades ,14.441,15,4.0,6,10Milazo
Limpiador Facial Rodillo - Unidad a $21244,19.888,12,0,0,JDAG
Leche Limpiadora 250ml - mL a $80,19.900,0,4.0,1,Agrado
Kit Limpieza Facial Foreo Exfolian - Unidad a $9738,77.900,0,2.8,6,Essntial In
Desmaquillador Bifasico Facial - mL a $178,8.900,0,3.4,8,Romantic Beauty
Set De Limpieza Facial De Cala,84.000,0,0,0,Cala
Parches Control Diabetes Equilibrio De Azucar 100% Naturales,18.293,39,4.8,6,PARCHES DIABETICOS
Parches Desintoxicantes 50 Unid,59.415,15,5.0,1,Kinoki
Pomitos Desmaquilladores - L a $150,14.990,0,5.0,1,Beautika
Masajeador Facial Limpieza Profunda Ultrasonico Cuidado,34.190,5,2.8,12,Genérica
Limpiadora Facial Mary Kay - g a $65900,65.900,0,4.4,5,Mary Kay
Cepillo De Limpieza Facial Foreo Clean Balance Luna 4 Bundle,1.335.594,0,0,0,Foreo
Epoch® Polishing Bar - g a $530,53.000,0,4.5,34,Nu Skin
Difusor Vaporizador Facial Portátil Humidificador Recargable,13.900,0,3.1,7,Safe Store
Vapor Ozono Facial Profesional ,64.728,28,0,0,Osenjie
Cepillo de limpieza facial Xiaomi Inface 2 versión recargable,48.000,0,0,0,Xiaomi
Masajeador Limpieza Facial - Unidad a $12900,12.900,0,0,0,Brand not found
Suero Facial Hydrafacial X3 U De 400ml - mL a $155,185.990,0,4.9,27,Brand not found
Sauna Vaporizador Facial Profesional A506 Rejuvenecedor,68.500,0,4.8,17,Benice
Crema Reafirmante Y Reafirmante La Piel Wevupa Para Rostr,52.176,5,0,0,Generic
Cepillo De Limpieza Facial Eléctrico 3 En 1 Giratorio Limpio,175.957,3,0,0,Genérica
"Cepillo De Limpieza Facial, Exfoliante De Silicona Umickoo,",156.340,0,0,0,Umickoo
"Limpiador Facial, Mini Spa Eléctrico 5 En 1",11.000,0,4.6,20,Brand not found
Cepillo Exfoliante Facial,22.000,0,4.1,9,GypsyMarket Co
Salilex Barra Limpiadora - Medihealth,51.750,25,4.5,12,Medihealth
Nixoderm Crema Para El Acné 20g - g a $925,18.500,0,5.0,5,Nixoderm
Crema De Progesterona W Para La Menopausia 100 Ml Bio Identi,53.483,7,5.0,2,Generic
"Umickoo Cepillo De Limpieza Facial, Recargable Ipx7 Resisten",239.744,0,0,0,Umickoo
Cepillo Facial Silicona Conair - Unidad  Color Rosa,104.930,30,0,0,Conair
Esponja Facial Celulosa X 6 Uni - Kg a $639,6.952,12,0,0,Huini
Parche Desintoxicantes 10und   ,12.900,0,4.2,42,Kinoki
Cutifresh Wash Gel Limpiador ,90.900,23,4.7,3,Carnot
. Medicube Mascarilla Collagen Night Mask Wrapping Peel Of,57.993,13,0,0,Generic
Cepillo De Limpieza Facial De Silicona Genérico Ice Face Rol,97.361,0,0,0,GeeRic
Limpiador Facial Beurer Fc49 - Unidad,211.756,40,0,0,Beurer
Class Gold Tonico Facial Aclara - mL a $1880,47.000,0,5.0,3,Class Gold
3×fresh Breath Essence - Gotas Menta For El Mal Aliento,81.507,0,4.4,7,Generic
Glicolic Shampoo Acido Glicolico 10%  X 240ml,125.100,0,0,0,Medihealth
Depurador Facial De Silicona For Limpieza Facial De Hombres,102.937,3,0,0,Generic
Parche Desintoxicantes 30und - Unidad a $1411,39.675,25,4.7,26,Kinoki
Masajeador Facial 12 En 1 Exfol - Unidad a $30000,30.000,0,5.0,1,Cnaier
Synderm Plus Limpiador - Pharmaderm,73.000,0,4.8,24,Pharmaderm
4pcs La Roche /hyalu,173.793,0,0,0,Generic
Cepillo Silicona Limpieza Facial Pulpo Cuidado Piel Derma,9.900,0,0,0,Megahobbies
Fh Kelo-cote Gel Para Las Cicatrices 15 G,66.382,21,0,0,LANGYIMD
Parche Desintoxicantes 50 Kinok,29.665,15,0,0,Kinoki
Cepillo De Limpieza Facial De Silicona Recargable,168.345,0,0,0,P&N
. Sérum Original Roche Posay Cicaplast B5/ Vitamina Pura,105.017,17,0,0,Generic
Vapor Ozono Portatil Facial Cor,186.900,0,4.9,16,Family
Tbestmax Cepillo Facial Manual Limpiador De Limpieza De La P,153.409,0,0,0,Tbestmax
"Máscara De Colágeno Para Envolver La Noche Medicube, 3 Unida",90.407,5,0,0,"generic,Collagen Night Wrapping Mask, Collagen Night Wrapping Peel Off Facial Mask, Collagen Overnight Wrapping Mask"
2 Unidades Roche Posay Effaclar/retinol B3/hyalu B5/vitamina,89.473,9,0,0,XU
Cepillo Aseo Facial Gel Sílice - Unidad a $21244,21.244,6,5.0,1,Harko
Desmaquillador Bifasico Lbel X - mL a $232,28.999,0,0,0,L'Bel
"2 Cepillos De Limpieza Facial, Limpiador Facial De Silicona",116.425,0,0,0,Leeshine
Esponja Facial Celulosa Comprim X12- - Unidad a $90,12.900,0,5.0,4,foaincore
Leche Limpiadora Clarins Velvet 200 Ml Galardonada,259.554,14,0,0,Clarins
Toallas Desmaquilladoras Extracto De Algodón Vitamina E ,16.958,14,5.0,1,Hilda Strauss
Cepillo De Limpieza Facial 3-1 ,34.990,0,0,0,Genérica
"Crema Para Eliminar Tatuajes, Permanente Y Útil, Para Elimin Color 4 Pcs",74.531,0,0,0,Genérica
"Cepillo De Limpieza Facial Manual, Cerdas De Fibra De Carbon",139.709,0,0,0,Lingol
Crema Instantánea Ojeras Eye Cream X5 Packs,76.000,5,0,0,Eelhoe
"Dispositivo De Estiramiento Facial Con Microcorriente Usb, L",42.900,0,2.8,4,2024
"Hidratación Facial Spray, Nano Vapor Para La Cara Portable ",14.900,0,3.0,11,Otra Marca
Vaporizador Sauna Facial Spa Limpiador Poros Puntos Negros,55.000,0,0,0,Osenjie
"Dageda 2 Esponjas Faciales Konjac, Limpieza Profunda De Poro",110.603,0,0,0,DAGEDA
Cepillos Eléctricos Para Lavado De Cara Máquina Limpiadora,55.496,16,0,0,Genérica
Vapor Ozono 1 Brazo Calor/frio,384.400,0,4.0,6,Vaporozono
Crema A Base Cafeína Antiojeras - g a $1500,29.990,0,5.0,1,Generic
"Toallita Para Desmaquillar, Microfibr - mL a $11900",11.900,0,0,0,Trendy
2×crema For Eliminar El Acné A Base De Wart Remover,66.382,6,0,0,Generic
Kit de esponja limpiadora facial Forever Electric 02,21.750,13,0,0,Forever
"Limpiador Facial, Mini Spa Eléctrico 5 En 1",11.000,0,4.6,20,Brand not found
Cepillo Exfoliante Facial,22.000,0,4.1,9,GypsyMarket Co
Exfoliante Facial Hombre Barbershop 250g Cara Piel Suave ,34.990,0,5.0,9,Barber Shop
Vapor-ozon Pedestal Doble Brazo,485.980,0,4.2,17,Genérica
Parches Desintoxicantes X10und,11.200,5,0,0,Genérica
Cepillos Faciales De Silicona Para Piel Sensible 2 Unidade,73.990,0,0,0,MtBoi
Cepillo Facial De Gel De Sílice - Unidad a $21244,21.244,6,0,0,Harko
Make B. Skin Skin Mousse De Limpieza To - mL a $281,42.210,18,0,0,O Boticário
"Botellas De Viaje Mujer, Kit Viajero, 11 Pcs Contenedores",23.000,0,0,0,Home Store
Puntas Diamante Micro Dermoabra - Unidad a $78000,78.000,0,4.2,5,Micro Crystal
Toallas Desmaquilladoras,17.000,0,4.8,6,Abrigados
Cepillo De Limpieza Facial Profunda 5 En 1 Eléctrico Exfolia,29.990,0,0,0,As Seen On Tv
Pads,12.400,0,4.0,2,Pads
Humificador Vaporizador Facial Portátil Recargable.,19.900,0,0,0,Genérica
"Parche Para El Dolor Menstrual, Almohadilla Térmica Portátil",21.900,0,1.7,3,Genérica
Reus Research Suplementos Vitamínicos De Energía,143.917,0,0,0,nmn
Máquina De Masaje Facial De Micro - Unidad a $93170,93.170,8,0,0,Generic
Agua Micelar Desmaquilla 400ml - mL a $72,28.600,0,5.0,1,Garnier
Biretix Tri Active Spray 100 Ml,145.900,0,5.0,1,Cantabria Labs
Difusor Vaporizador Facial Portátil Humidificador Recargable,19.900,0,0,0,Genérica
Nixoderm Crema Para El Acné 2und - g a $1975,39.500,0,0,0,Nixoderm
Set De Limpieza Facial Eléctric,53.940,40,4.4,5,TouchBeauty
Nano Mist Vaporizador Frio Faci,12.058,0,4.5,2,Nanomist
Humidificador Mini Vaporizador Facial Portatil Recargable,19.990,0,3.6,8,Nano
Cepillo De Limpieza Facial: Dispositivo Limpiador Electrico ,138.340,0,0,0,COSLUS
Toalla Mágica Removedor Maquillaje Mujer Lavable Microfibra,13.900,0,5.0,1,Toalla Retira Maquillaje Microfibra Limpieza Facial
Dermaroller Tratamiento Facial,11.990,0,0,0,Vittoria
Parches Desintoxicantes 100und - Unidad a $622,62.160,30,0,0,Kinoki
Cepillo Facial Skinvigorate,182.700,10,0,0,Mary Kay
"Cepillo De Limpieza Facial Manual, Cepillo De Limpieza De",41.030,24,0,0,Other
Guante Estropajo Exfoliante - Unidad a $6590,6.590,0,5.0,1,Hobby
Agua Micelar Garnier Skinactive Sensible X 100ml,11.300,0,0,0,Garnier
Crema Blanqueadora Hidratante G Collagens Brightening Mo 400,56.413,18,5.0,1,Generic
Vapor Ozono Pedestal Profesiona,399.000,0,4.0,4,Novedades Online Cali
Masajeador Cepillo Silicona Recargable Limpieza Facial Profe,27.552,7,4.0,1,MASAJEADOR
2 Duo De Cepillos De Silicona Para Rostro: Belleza 2 Piezas,47.353,13,0,0,Other
"Cinta Bucal Para Dormir, 120 Unidades, Gentle Sleep Strip 50",46.423,12,5.0,4,Generic
Vaporizador Sauna Spa Facial Eléctrico Limpieza Benice,50.900,0,4.6,35,Benice
Limpiador Facil Cetaphil Oil Control X 250ml,114.700,0,0,0,Cetaphil
Parche Intensificador Para Estimular El Crecimiento De Adult,48.902,14,4.0,3,Genérica
"Cepillo De Limpieza Facial Con Mango De Madera, Cepillo",111.385,0,0,0,Generic
Máquina Peladora Facial De Microdermoabrasión Para Limpieza,650.473,0,0,0,Genérica
Vaporizador Sauna Facial Limpieza Poros Puntos Negros,49.900,0,0,0,Zebbris
Cinturón Ciática Soporte Espalda Alivio Dolor Pelvis,51.850,39,3.5,6,Genérica
"Cepillo Facial De Madera Para Limpieza Facial, Mango De Haya",53.344,44,0,0,Generic
Cepillo 5 En 1 Facial Limpieza - Unidad a $14900,14.900,0,4.0,1,GN
Parche Desintoxicantes 50und -,58.799,16,0,0,Kinoki
Crema 2d Dermatology Despigmentate Antioxidante X 30ml,92.000,0,5.0,2,2D
Cepillo Limpieza Facial Masajea,12.900,0,0,0,Genérica
Máquina De Masaje Facial De Microcorriente 1u Para Refinamie,100.210,0,0,0,Generic
"Limpiador Facial, Mini Spa Eléctrico 5 En 1",11.000,0,4.6,20,Brand not found
Cepillo Exfoliante Facial,22.000,0,4.1,9,GypsyMarket Co
Sauna Facial Vaporizador Poros,53.900,0,4.5,19,Genérica
"Cepillo De Belleza Para Limpieza Facial, Jabón Facial De Man",53.532,43,0,0,Generic
Vapor Ozono Facial Capilar 2en1,250.000,0,0,0,Brand not found
Masajeador Facial Limpieza Profun - Unidad a $33300,37.000,0,0,0,Icoco
"Cápsulas En Polvo De Rosabella Moringa, 1 Unidad",57.531,16,0,0,Generic
Vapor Ozono Portatil Facial Ext,171.400,0,5.0,5,Family
Vapor Ozono Facial Profesional ,43.990,0,4.0,1,Osenjie
Limpiador Facial Ponds Fruity Hydra Fresh Dia X 200ml,15.020,60,5.0,2,Pond's
 Vaporizador Facial Power Bank,23.000,0,4.0,1,Genérica
"Gymqian Cepillo De Limpieza Facial Manual, Cepillo 2 En 1, E",148.119,0,0,0,Gymqian
