product_name,price,discount,review_rating,review_amount,brand
Toalla Desechable Toalla De Limpieza Facial De Algodón Suave,77.667,2,0,0,Generic
Vaporizador Facial Mini Spa Limpieza Poros Puntos Negros  ,56.900,0,0,0,Osenjie
"Cepillo De Limpieza Facial Tools Cleaning, 6 Unidades",57.967,22,0,0,Genérica
Desmaquillante Pétalos D Flores - mL a $63,18.990,0,0,0,Fragrant flowwer petals
"Herramienta De Limpieza Facial Para El Cuidado Facial, Juego",190.438,0,0,0,Elitzia
Paquete De 2 Cepillos De Limpieza Facial Con Cerdas Naturale,153.409,0,0,0,UAIAGM
"Brochas Faciales 6 En 1 Para Limpieza Y Exfoliacin, Cepillo",327.977,0,0,0,BSROLUNA
Hangsun Sc200 - Cepillo De Limpieza Facial Sonico Para Limpi,536.464,0,0,0,Hangsun
"Cepillo De Limpieza Facial Para Uñas, Uso A Mano, 6 Unidades",57.567,22,0,0,Genérica
Vaporizador Sauna Spa Facial Eléctrico Limpieza Benice,46.900,0,0,0,Genérica
Vaporizador Sauna Spa Facial Eléctrico Limpieza Benice,46.900,0,0,0,Genérica
Juego De Cepillo Giratorio Para Limpieza Facial A Prueba De ,109.900,0,0,0,Clsevxy
Sauna Facial Portátil Zeny 2 En 1: Limpieza Profunda Y Humec,533.000,0,0,0,Zeny
"Cepillo De Limpieza De Doble Cara, 3 Unidades",60.666,24,0,0,Genérica
~? Cepillo De Limpieza Facial: Depurador Facial Para Hombres,172.900,0,0,0,TouchBeauty
"Cepillo De Limpieza Facial, Estropajo Facial Eléctrico Recar",137.900,0,0,0,Blue Oasis
Vaporizador Facial Para Limpieza Profunda Y Humidificador De,230.990,0,0,0,Dr. Pure
Toallitas Faciales | Toallitas De Limpieza Facial Con Vitami,250.312,0,0,0,Body Prescriptions
"Cepillo De Limpieza Facial, Limpiador Facial Electrico Recar",215.385,0,0,0,Orauley
"Cepillo De Limpieza De Doble Cara, 3 Unidades",54.212,10,0,0,Genérica
Esponjas Faciales Comprimidas Para Limpieza Facial Reutiliza,61.915,0,0,0,Generic
"Brochas Faciales 6 En 1 Para Limpieza Y Exfoliacin, Cepillo",325.988,0,0,0,BSROLUNA
Cepillo Eco Bamboo Limpieza Facial Belleza Cuidado Personal,45.900,0,0,0,Genérica
Suaviskin Cepillo De Limpieza Facial Snico Multifuncional Ip,196.461,0,0,0,Suaviskin
"Cepillo De Limpieza De Doble Cara, 3 Unidades",61.558,22,0,0,Genérica
Sauna Facial Limpia Rostro Poro,74.900,0,0,0,Vaporizador Facial Aromaterapia Limpieza Belleza Facial
Cepillo Facial Eléctrico De Silicona Para Limpieza Profunda ,290.000,0,0,0,Alyfini
"Umickoo Exfoliante Facial, Cepillo De Limpieza Facial Imper.",195.990,0,0,0,N/A
Plum Beauty - Sistema De Limpieza Facial Perfecto Para Todo.,108.990,0,0,0,N/A
True Glow By Conair - Cepillo De Limpieza Facial Con Pilas,144.990,0,0,0,N/A
"Limpiador Facial, Mini Spa Eléctrico 5 En 1",11.000,0,4.6,20,Brand not found
Cepillo Exfoliante Facial,22.000,0,4.1,9,GypsyMarket Co
"Cepillo Facial De Silicona Para Hombres, Cepillo De Limpieza",109.519,0,0,0,Vwmyq
"Cabezal De Repuesto Para Cepillo De Limpieza Facial, Cabezal",97.991,0,0,0,CONVELIFE
"Cepillo De Limpieza Facial De Madera, Cepillo De Limpieza Fa",92.227,0,0,0,Joyzan
"Cepillo De Limpieza Facial, Limpiador Facial Electrico Recar",207.509,0,0,0,Orauley
"Cepillo Facial De Limpieza Manual, Ultrasuave, Desmaquillant",53.283,0,0,0,Generic
"Vocoste Cepillo De Limpieza Facial De Silicona, Limpiador Fa",109.519,0,0,0,Vocoste
Cepillo Limpieza Facial Exfolia,14.900,0,0,0,Genérica
"Agua Micelar Garnier Con Ácido Hialurónico, Limpieza Facial.",198.800,0,0,0,Garnier
Cepillo De Limpieza Facial Y Exfoliante Facial: Lfoyou Recar,130.250,0,0,0,LFOYOU
"Cepillo De Limpieza Facial De Silicona Para Hombres, Cepillo",115.283,0,0,0,Vwmyq
"Cepillo De Limpieza Facial, Exfoliante Facial Eléctrico, Gel",261.750,0,0,0,Crehora
* Cepillo De Limpieza Facial De Silicona Recargable,150.289,0,0,0,Generic
Cepillo De Limpieza Facial Ultrasónico Impermeable,70.055,0,0,0,Generic
A Máscara Facial De Espuma De Zanahoria For Limpieza,62.631,0,0,0,común (uso)
"Cepillo Facial Suave, Mango Largo, Limpieza Facial Manual",55.805,26,0,0,Generic
"Exfoliante Facial, Almohadilla De Limpieza Facial De Silicon",86.463,0,0,0,Mr Lion
Cepillo Facial Inalámbrico De Plástico De Limpieza Facial El,319.484,51,0,0,Generic
Cepillo De Limpieza Facial 2en1 - Unidad a $17500,17.500,0,0,0,Miis Cosmetics
"Esponja De Limpieza Facial De Celulosa, Esponja 20 Piezas",47.796,13,0,0,Other
"Cepillo De Limpieza Facial, H - 7350718:mL a $95990",95.990,0,0,0,N/A
Airelle Limpiador Facial Exfoliante | Exfoliante De Limpieza,368.905,0,0,0,Airelle Skincare
Cepillo De Limpieza Facial - 7350718:mL a $130990,130.990,0,0,0,N/A
Limpiadora Facial Eléctrica Reca - Unidad a $152432,152.432,0,0,0,Generic
"Cepillo De Limpieza Facial | Exfoliante Facial, Limpiador Ex",121.047,0,0,0,Visofo
Limpieza Facial Y Masaje De Cepillos Y Almohadillas 5 1...,131.200,0,0,0,Bisou Bisou Bisou
"Cepillo Facial 5 En 1 Para Limpieza Profunda, Masaje Y",102.118,0,0,0,Prettysee
2 Cepillo Facial De Silicona Para Masaje Y Limpieza 2 Piezas,50.627,6,0,0,Other
Olay Diaria Facial Hidratante Toallitas De Limpieza W/,129.305,0,0,0,Toallitas
Cepillo Limpiador Facial Mk ,250.900,0,0,0,Mary Kay
Brushot Juego De Cabezales De Cepillo De Limpieza Facial De,285.354,0,0,0,Brushot
Esfoliante  Scrub Clinique 100 Ml Todo - mL a $1045,110.000,0,0,0,Clinique
4 X 2xoctopus Lindo Cepillo Facial De Silicona Para 4 Piezas,55.384,6,0,0,Other
Limpiador Anti-blemish Solutions Cleans - mL a $927,115.900,5,0,0,Clinique
"Cepillo Facial Eléctrico Exfoliante Recargable, Exfoli...",212.300,0,0,0,Iweel
"Neti Pot Sal De Limpieza Nasal, No Yodada Sal Pura Uso ...",200.100,0,0,0,ANCIENT  S
"Cepillo De Limpieza Facial, Limpiador Facial De Silicona Någ",247.822,0,0,0,NågraCoola
3 Cepillo Facial De Silicona Para Masaje Y Limpieza 3 Piezas,54.256,6,0,0,Other
Cepillo De Limpieza Facial,87.000,0,0,0,Genérica
Burt S Bees Toallitas Húmedas Faciales Para Limpieza De To.,108.990,0,0,0,N/A
Beplain Mung Bean - Toallitas De Limpieza Facial Balanceada.,78.990,0,0,0,N/A
Cepillo Pulpo Limpiador Facial,18.000,0,0,0,Genérica
Cicatricure Agua Micelar Limpieza Facial Todo En 1 -,109.900,0,0,0,Cicatricure
6 Paquete De 5-6 Cepillos Faciales De Silicona Con 6 Piezas,54.579,9,0,0,Other
"Cepillo De Limpieza Facial, - 7350718:mL a $493990",493.990,0,0,0,N/A
"Cepillo Facial Eléctrico, Exfolia - Unidad a $12345",246.900,0,0,0,Orauley
"Jabón Facial Iope, Espuma Batida Limpiadora Húmeda, Limpieza",220.850,0,0,0,Iope
Mascarilla Facial Con Parche De Cristal Hidrolizado Para Pie,69.525,7,0,0,Generic
"Cepillo De Limpieza Facial Grande, 6 Unidades",75.560,0,0,0,Genérica
"Limpiador Facial, Mini Spa Eléctrico 5 En 1",11.000,0,4.6,20,Brand not found
Cepillo Exfoliante Facial,22.000,0,4.1,9,GypsyMarket Co
Cepillo De Limpieza Facial Ultrasónico Impermeable,70.055,0,0,0,Generic
Máscara Facial De Espuma De Zanahoria Para Limpieza Y Máscar,42.883,19,0,0,Generic
Instrumento De Limpieza. Limpiador Facial Con Cepillo Facial,69.297,0,0,0,Generic
Toallas Faciales Desechables 50 Unidades Limpieza Piel Sensi,57.990,0,0,0,Aidea
Luna 3 Limpiador Facial Sónico Y Masajeador Para Piel Mixta,106.964,3,4.0,1,Foreo
Instrumento De Limpieza Facial Portátil Vibratorio Instr,59.700,0,0,0,Generic
Cepillo De Limpieza Facial+ Estacion Inteligente Tao Blanco,962.194,0,0,0,TAO Clean
Juego De Cepillos Eléctricos Para Limpieza Facial Bestidy,201.533,0,0,0,Brand not found
Cabezal De Repuesto Para Cepillo De Limpieza Facial,201.600,0,0,0,Brand not found
Cepillo Facial Exfoliante Manicure - Unidad a $5000,5.000,0,4.0,5,Genérica
Sistema De Limpieza De Spa Eléctrico Con Cepillo Facial,133.900,0,0,0,Brand not found
Cepillo De Limpieza Facial Con Doble Movimiento Y 3 Cabezale,547.900,0,0,0,Brand not found
Cepillo De Limpieza Facial,878.900,0,0,0,Brand not found
Set De Limpieza Facial De Cala,28.000,0,0,0,Cala
"Cepillo De Limpieza Facial Sónico, Dispositivo De Limpieza D",296.500,0,0,0,Brand not found
Limpiador Facial Flawless Cleanse Masajeador De Silicona,29.999,0,5.0,3,Flawless
"Cepillo De Limpieza Facial Sónico, Dispositivo De Limpieza D",291.500,0,0,0,Brand not found
"Cepillo De Limpieza Facial Sónico, Dispositivo De Limpieza D",291.500,0,0,0,Brand not found
Cepillo De Limpieza Facial Con 2 Cabezas - Olay,379.589,0,0,0,Olay
Cepillo De Limpieza Facial Rosa Recargable - Caytraill,465.090,0,0,0,Caytraill
Cepillo Exfoliante X2 Nariz - Unidad a $3225,12.900,0,5.0,2,B&B
Cepillo De Limpieza Facial Morado Recargable - Caytraill,451.173,0,0,0,Caytraill
Cepillo De Limpieza Facial Naranja De 5 Cabezales - Gackoko,220.515,0,0,0,Gackoko
Cepillo De Limpieza Facial 3 En 1 Con Estuche Rosa - Clsevxy,306.016,0,0,0,Clsevxy
Cepillo De Limpieza Facial Verde Con Luz Azul Y Roja Misiki,506.848,0,0,0,Misiki
Cepillo De Limpieza Facial Rosa Vibratorio - Ezbasics,321.925,0,0,0,Ezbasics
Limpiadora Peeling Scrubber Pal,83.000,0,0,0,B115
Cepillo De Limpieza Facial Azul Vibratorio - Ezbasics,321.925,0,0,0,Ezbasics
Cepillo De Limpieza Facial Negro Para Hombres - Touchbeauty,276.190,0,0,0,TouchBeauty
Cepillo De Limpieza Facial 5en1 Con Funcion De Luz Roja/azul,453.160,0,0,0,liaboe
Cepillo De Limpieza Facial Azul 3 En 1 - Lanbeibei,248.354,0,0,0,Lanbeibei
Limpiador Espátula Ultrasonido ,29.900,0,4.1,16,Genérica
Cepillo De Limpieza Facial Rosa Blanco 5 En 1 - Clsevxy,194.666,0,0,0,Clsevxy
Cabezal De Cepillo De Limpieza Facial Para Poros Obstruidos,159.900,0,0,0,Brand not found
Silk'n Bright Cepillo De Limpieza Facial Ultrahigiénico,529.000,0,0,0,Silk'n
Modvica Vaporizador Facial De Limpieza Profunda E Hidratació,540.968,0,0,0,Modvica
Limpiador Exfoliante Recargable - Kg a $12600,12.600,0,5.0,1,Tor Technology
Cepillo De Limpieza Facial 3d El¿ - Unidad A $63900,69.900,0,0,0,Genérica
Cepillo Facial 2x1 Limpieza Facia - Unidad a $44950,89.900,0,0,0,Brand not found
Hieerbus Cepillo De Limpieza - Unidad a $25200,25.200,0,0,0,Hieerbus
Vaporizador Facial Nano Iónico Portátil Para Limpieza De Ros,263.000,0,0,0,Brand not found
Facial Cepillo De Limpieza De La Cara De Giro A Prueba ...,157.300,0,0,0,Brand not found
Limpiador Facial Xn-8030 ,29.900,0,0,0,Genérica
7 En 1 Impermeable Eléctrica Facial Cepillo De Limpiez...,254.300,0,0,0,Brand not found
Desmaquillantes 5.5 Ph Equilibrante Tóner De Limpieza 5.1 Oz,159.900,0,0,0,Acwell
Limpieza Facial Eléctrica Cepillo Lavado Limpieza Facial Máq,254.342,0,0,0,Genérica
Mini Limpieza Facial Eléctrica Cepillo Impermeable Limpiador,197.714,0,0,0,Genérica
Mini Spa Masajeador Y Limpiador Facial 5 En 1 ,10.800,28,3.9,54,Brand not found
"Limpiador Facial, Mini Spa Eléctrico 5 En 1",11.000,0,4.6,20,Brand not found
Cepillo Exfoliante Facial,22.000,0,4.1,9,GypsyMarket Co
2 En 1 De Silicona Manual De Facial Cepillo De Limpieza...,104.300,0,0,0,Brand not found
3 En 1 Limpieza Facial Cepillo 9 Velocidades Ajustables...,229.300,0,0,0,Brand not found
4 En 1 De Silicona Cepillo De Limpieza Facial Y De Acer...,203.300,0,0,0,Brand not found
Cara Eléctrica Facial Cepillo De Limpieza Cepillo De L...,123.300,0,0,0,Brand not found
Avanzada Cepillo De Limpieza Facial Y Corporal Con El M...,200.300,0,0,0,Brand not found
Función Multi Sónica Facial Cepillo De Limpieza De Ca...,236.300,0,0,0,Brand not found
Cara Del Cepillo Cepillo De Limpieza Facial 2021 Actual...,266.300,0,0,0,Brand not found
Facial Cepillo De Limpieza Cepillo De Giro Más Recient...,123.300,0,0,0,Brand not found
Facial Eléctricos Cepillo De Limpieza Para Todo Tipo D...,183.300,0,0,0,Brand not found
Sónica Facial Cepillo De Limpieza 2 Pack Cepillo Limpi...,200.300,0,0,0,Brand not found
Cepillo Limpio Limpieza Facial Sónica | Limpieza Facia...,230.300,0,0,0,Brand not found
Facial Cepillo De Limpieza Cepillo De Giro Más Recient...,230.300,0,0,0,Brand not found
Accionada Facial Cepillo De Limpieza A Prueba De Agua A...,188.300,0,0,0,Brand not found
La Cara De Silicona Facial Cepillo De Limpieza De Lavad...,144.300,0,0,0,Brand not found
Cara Impermeable Facial Cepillo De Limpieza Cepillo De ...,138.300,0,0,0,Brand not found
Limpiadora Peeling Scrubber Pal,148.550,0,0,0,B115
5 En 1 Cepillo De Limpieza Facial Cara Impermeable Cepi...,144.300,0,0,0,Brand not found
Eléctrica Cepillo De Limpieza Facial 7 En 1 Cara Cepil...,110.300,0,0,0,Brand not found
Cepillo De Limpieza Facial Versión Mejorada Cara Recar...,297.300,0,0,0,Brand not found
Resistente Al Agua De Limpieza Facial Giro Sistema De C...,144.300,0,0,0,Brand not found
Limpiador Ultrasónico De Poros - Unidad a $48990,48.990,0,0,0,Muye
Cepillo 3in1 Cara De Silicona Limpieza Facial Sonic Lim...,254.300,0,0,0,Sonic
Raedia Cepillo De Limpieza Facial Con 3 Cabezales Inter...,291.300,0,0,0,Brand not found
Facial Cepillo De Limpieza Eléctrico Ipx7 Recargable I...,272.300,0,0,0,Brand not found
Sónica Facial Cepillo De Limpieza Cepillo De Silicona ...,144.300,0,0,0,Brand not found
"Limpiador Ultrasónico, Peeling , Eliminación Acné",108.000,10,0,0,Brand not found
Facial Cepillo De Limpieza Cepillo Cepillo Facial Ubbet...,123.300,0,0,0,Brand not found
Suave De Silicona Manual De Facial Cepillo De Limpieza ...,98.300,0,0,0,Brand not found
Facial Cepillo De Limpieza Spa Piel Último Con 3 Cepil...,200.300,0,0,0,Brand not found
Pura Radiación Sónica Cepillo De Limpieza Facial Vibr...,254.300,0,0,0,Brand not found
Doble Cara Manual Cepillo De Limpieza Facial 2 En 1 Car...,117.300,0,0,0,Brand not found
Facial Cepillo De Limpieza De Silicona Suave Ipx7 Eléc...,151.300,0,0,0,Brand not found
Eléctrico Facial Cepillo De Limpieza Cara Impermeable ...,302.300,0,0,0,Brand not found
Facial Cepillo De Limpieza Giro Impermeable Cara Cepill...,183.300,0,0,0,Brand not found
Cepillo De Limpieza Facial Ip68 Resistente Al Agua 5 Ca...,266.300,0,0,0,Brand not found
Outtmer Cepillos De Limpieza Facial Recargables Cepillo...,154.300,0,0,0,Brand not found
Vaporizador Ozono Portatil Facial Profesional Limpieza,239.900,0,0,0,Bioderma
"Cepillo De Limpieza Facial Sónico, Dispositivo De Cepillo De",291.000,0,0,0,NågraCoola
Elle Cepillo De Limpieza Facial Para Eliminar El Maquillaje ,143.000,0,0,0,Elle
Limpieza Facial Inteligente Y Reafirmante Masaje,2.407.900,0,0,0,Foreo
Manuales - Moschow 6 En 1 Cepillo De Limpieza Facial Con Fun,151.000,0,0,0,MOSCHOW
Manuales - Cepillo De Limpieza Facial Kol,143.000,0,0,0,KOL
Manuales - 2 Mini Guantes Mini Cepillo De Limpieza Facial De,114.000,0,0,0,FLORAISON BEAUTY IS ALREADY HERE
Limpieza Facial - Water-resistant Facial Cleansing Spin Brus,113.000,0,0,0,CLSEVXY
Limpieza Facial - Cosbeauty Facial Cleansing Brush Face Gent,563.000,0,0,0,CosBeauty
Limpieza Facial - Sonic Facial Cleansing Brush Soft Silicone,178.000,0,0,0,Greatee
Limpieza Facial - Umickoo - Cepillo De Limpieza Facial Con L,263.000,0,0,0,Umickoo
Pala Ultrasonica Depurador Facial Ultrasonico Recargable,94.900,0,4.5,2,Genérica
"Limpiador Facial, Mini Spa Eléctrico 5 En 1",11.000,0,4.6,20,Brand not found
Cepillo Exfoliante Facial,22.000,0,4.1,9,GypsyMarket Co
"Limpieza Facial - Cepillo De Limpieza Facial, Depurador Faci",171.000,0,0,0,Uimoky
Limpieza Facial - Michael Todd Beauty Soniclear Petite Siste,1.043.000,0,0,0,Michael Todd
"Limpieza Facial - Elle Facial Cleansing Power Brush, Remove ",142.000,0,0,0,Elle
"Limpieza Facial - Sonicderm - Professional Cleansing System,",113.000,0,0,0,Sonicderm
"Limpiador Ultrasónico, Peeling - Unidad a $105051",110.400,8,4.7,3,Toyuyugo
Limpieza Facial - Facial Cleansing Brush - Silicone Face Bru,311.000,0,0,0,NORLANYA BEAUTY EQUIPMENT
Limpieza Facial - Touchbeauty Cepillo De Limpieza Facial Par,191.000,0,0,0,TouchBeauty
Limpieza Facial - Champú - Facial Cleansing Brush Electric F,191.000,0,0,0,TouchBeauty
Limpieza Facial Natural 30gr - g a $1500,45.000,0,0,0,NatúCosmetic
Limpiador Masajeador Facial - Unidad a $13900,13.900,0,5.0,3,Tomson
Toallitas - Toallitas Faciales De Limpieza Simples Para La P,273.000,0,0,0,Simple
Olay Regenerist - Cepillo De Limpieza Facial Con 2 Cabezales,233.825,0,0,0,Brand not found
Olay Regenerist - Cepillo De Limpieza Facial Con 2 Cabezales,234.055,0,0,0,Brand not found
Enjuagues - Gel De Limpieza Facial Vegano Y Sin Crueldad Con,190.000,0,0,0,Hanalei
Limpiadora Peeling Scrubber Pal - Unidad a $89990,89.990,0,0,0,B115
Gel - Tratamientos Faciales De Gel De Limpieza Básicos Que B,92.000,0,0,0,Que Bella
Enjuagues - Gel De Limpieza Diaria Adonia - Lavado Facial Or,212.000,0,0,0,Adonia Organics
Cepillo De Limpieza Facial: Dispositivo Limpiador Eléctrico ,184.855,0,0,0,Brand not found
Umickoo - Cepillo De Limpieza Facial Con Luz Led Roja Y Azul,234.225,0,0,0,Brand not found
Ezbasics Cepillo De Limpieza Facial Hecho Con Silicona Suave,175.959,0,0,0,Brand not found
Cepillo Exfoliante Facial,21.500,0,0,0,Gypsy Market
Limpieza Facial Sistema Escobillas Eléctricas 4n1 + Accesori,146.500,0,0,0,BriteLeafs
Desmaquillador Facial - mL a $84,41.990,0,0,0,Images
"Cepillo De Limpieza Facial Sónico, Dispositivo De Cepi...",256.900,0,0,0,Brand not found
Cuidado Facial Limpiador Tonificante 250ml,314.500,0,0,0,Ahava
Limpiador Facial Espatula Depur,109.900,0,4.0,2,Ultrasonic Shovel
Sistema De Limpieza Facial 3en1 - Unidad a $277800,277.800,0,0,0,Brand not found
Limpieza Facial Inteligente Y Reafirmante Masaje,2.166.500,0,0,0,Foreo
Limpiador Exfoliante Facial Silicón Vibración Limpieza 005,47.900,0,0,0,Genérica
Cepillo De Limpieza Facial - Unidad a $79900,79.900,0,0,0,Conair
Masajeador Cepillo Silicona Recargable Limpieza Facial Profe,27.701,0,0,0,MASAJEADOR
Limpiador Facial Exfoliante Prep Panthenol Para Hombre 100 M,127.664,0,0,0,Prep
Tatuo 8 Almohadillas Exfoliantes De Limpieza Facial De Sili.,97.990,0,0,0,Tatuo
Cepillo De Limpieza Facial: Dispositivo Limpiador Eléctric.,187.990,0,0,0,COSLUS
Spa Sciences Nova - Cepillo De Limpieza Facial Sónico Pate.,233.990,0,0,0,Spa Sciences
Ezbasics - Vaporizador Facial Iónico Para Limpieza Profunda,293.902,0,0,0,DSI
Kit 3 Cepillo Exfoliante Facial - Unidad a $7000,20.999,0,0,0,Mieltech
Vtrem - 5 Cepillos De Limpieza Facial De Silicona Y Masajea.,112.990,0,0,0,Vtrem
Cepillo Facial Limpieza Dual Rosado,105.000,0,0,0,Cala
"Beautyfrizz Toallitas De Limpieza Facial De Lavanda, 120 Un.",135.990,0,0,0,Beautyfrizz
Earth Rhythm Almohadillas De Limpieza Facial Reutilizables .,165.990,0,0,0,Earth Rhythm
Aceite De Limpieza Facial | Removedor De Maquillaje Para Pi.,123.990,0,0,0,Dermaflage
Earth Rhythm Almohadillas De Limpieza Facial Reutilizables .,164.990,0,0,0,Earth Rhythm
Made With Care - Emulsión De Limpieza Facial De Maquillaje.,220.990,0,0,0,Made With Care
Made With Care - Emulsión De Limpieza Facial De Maquillaje.,221.990,0,0,0,Made With Care
"Milim Cepillo De Limpieza Facial De Silicona Mini, Masajeado",195.981,0,0,0,milim
"Beomeen - Cepillo De Limpieza Facial De Silicona, 3 Diseos,",126.811,0,0,0,Beomeen
Limpiador Masajeador Mini Spa 5 En 1 Belleza Cuidado Facial,15.900,0,4.5,31,Genérica
"Limpiador Facial, Mini Spa Eléctrico 5 En 1",11.000,0,4.6,20,Brand not found
Cepillo Exfoliante Facial,22.000,0,4.1,9,GypsyMarket Co
"Gainwell 100 Esponjas Faciales Comprimidas, Limpieza, Para U",172.925,0,0,0,Gainwell
"2 Esponjas Faciales, Almohadillas De Limpieza Facial, Esponj",126.811,0,0,0,Consio
Nuogo Paquete De 20 Cepillos De Limpieza Facial De Silicona ,138.340,0,0,0,Nuogo
"Beomeen Cepillo Facial 2 En 1, Cepillo Exfoliante De Limpiez",126.811,0,0,0,Beomeen
"Ua-gloy Cepillo De Limpieza Facial Mejorado, Cepillo Facial ",132.576,0,0,0,UA-GLOY
"Cepillo De Limpieza Facial, Depurador De Cara Impermeable De",155.632,0,0,0,WMM
"Cepillo De Limpieza Facial, Cepillo De Masaje Porttil De Sil",97.991,0,0,0,Serlium
Clsevxy - Juego De Cepillos Giratorios De Limpieza Facial Re,138.340,0,0,0,Clsevxy
"Cepillo De Limpieza Facial, 3 En 1 Elctrico De Silicona Para",178.689,0,0,0,Uimoky
Esponja De Limpieza Facial Facial Esponja De Lavado 2 Piezas,138.340,0,0,0,Exceart
"Cepillo De Limpieza Facial, Limpiador Facial De Mano De Sili",109.519,0,0,0,Ejoyous
"Cepillo De Limpieza Facial 7 En 1, Cepillo De Lavado Facial ",126.811,0,0,0,Fabuday
Toallitas - Toallitas Faciales De Limpieza Simples Para La P,273.000,0,0,0,Simple
Raya Aceite De Limpieza Facial De Manzanilla (154) | Limpia.,178.990,0,0,0,Raya
Raya Aceite De Limpieza Facial De Manzanilla (154) | Limpia.,179.990,0,0,0,Raya
"Nuogo Paquete De 40 Cepillos De Limpieza Facial, Exfoliante",211.598,0,0,0,Nuogo
"Ooloveminso - Cepillo De Limpieza Facial Manual, Cerdas De C",148.119,0,0,0,ooloveminso
"Cepillo Electrico De Limpieza Facial 7 En 1, Cepillo Girator",153.409,0,0,0,Fabuday
Cepillo De Limpieza Facial Lami 2 En 1,216.888,0,0,0,Lami Products
"Cepillos Faciales 6 En 1 Para Limpieza Y Exfoliacin, Cepillo",327.977,0,0,0,BSROLUNA
"Cepillo De Limpieza Facial, Cepillo Elctrico Para La Cara, E",248.628,0,0,0,Orauley
"Ooloveminso - Cepillo De Limpieza Facial, 3 Cepillos Manuale",158.699,0,0,0,Useekoo
"Limpiador Facial, Cepillo De Limpieza Facial, Herramienta De",137.539,0,0,0,Luckyiren
"Cepillo De Limpieza Facial, Recargable Por Usb, Impermeable,",148.119,0,0,0,TOPQIAO
"Hue - Cepillo De Limpieza Facial 3 En 1, Limpiador Facial De",206.308,0,0,0,HUE DECORATION
Beomeen - Cepillo De Limpieza Facial 2 En 1 Para Exfoliacin,153.409,0,0,0,Beomeen
"Cepillo De Limpieza Facial De Cerdas Suaves, Cepillo De Lava",148.119,0,0,0,RUIBAOCHEN
Bsroluna Cepillos Faciales De Silicona 3 En 1 Para Limpieza,285.657,0,0,0,BSROLUNA
"Siwiey - Cepillo De Limpieza Facial Sonico Impermeable Ipx7,",206.308,0,0,0,siwiey
"Limpiador Exfoliante Facial, Cepillo Manual De Limpieza Faci",158.699,0,0,0,Yiqingjie
"Cepillo De Limpieza Facial, Limpiador Facial Elctrico, Cepil",280.367,0,0,0,Heyfyv
"Cepillo De Limpieza Facial Touchbeauty, Cepillo Giratorio De",222.178,0,0,0,TouchBeauty
"Cepillo De Limpieza Facial, Cepillo Electrico De Limpieza Fa",148.119,0,0,0,TOPQIAO
Siwiey - Cepillo De Limpieza Facial Snico Impermeable Ipx7 P,201.018,0,0,0,siwiey
Beomeen Paquete De 2 Cepillos De Limpieza Facial De Cerdas S,163.989,0,0,0,Beomeen
"Cepillo Facial  Limpieza Facial Manual, Cepillo De Limpieza",153.409,0,0,0,WOBEVB
Cepillo Exfoliante Facial Limpiadora Poros Rostro 2801,15.900,0,5.0,1,Genérica
"Cepillos Faciales De Silicona Para Limpieza Y Exfoliacin, Ce",222.178,0,0,0,BSROLUNA
"Milim Cepillo De Limpieza Facial De Silicona Mini, Masajeado",222.178,0,0,0,milim
"Brochas Faciales Para Limpieza Y Exfoliacin, Cepillo De Limp",327.977,0,0,0,BSROLUNA
"Cepillo De Limpieza Facial Snico, Cepillo Limpiador Elctrico",169.278,0,0,0,TOPQIAO
Hue - Cepillo De Limpieza Facial 3 En 1 Electrico De Silicon,206.308,0,0,0,HUE DECORATION
Máquina De Succión De Espinillas Para Puntos Negros,79.714,0,0,0,Importación
"Ooloveminso - Cepillo De Limpieza Facial De Cerdas De Carbn,",158.699,0,0,0,ooloveminso
"Pwsap Herramienta De Limpieza Facial Con Gancho, Limpiador F",185.148,0,0,0,Pwsap
"Ooloveminso - Cepillo De Limpieza Facial, Cerdas De Carbn Ne",153.409,0,0,0,ooloveminso
"Topqiao Cepillo De Limpieza Facial, Cepillo Elctrico Imperme",169.278,0,0,0,TOPQIAO
Masajeador Facial Eléctrico 5 En 1 Exfoliante Y Limpiador,23.900,0,0,0,Brand not found
"Limpiador Facial, Mini Spa Eléctrico 5 En 1",11.000,0,4.6,20,Brand not found
Cepillo Exfoliante Facial,22.000,0,4.1,9,GypsyMarket Co
"Beomeen Cepillo De Limpieza Facial Para Exfoliacin Facial, C",150.674,0,0,0,Beomeen
Juego De 2 Cepillos De Limpieza Facial Manual De Doble Cabez,158.699,0,0,0,Nature Ann
"Ua-gloy Cepillo De Limpieza Facial Mejorado, Cepillo De Sili",158.699,0,0,0,UA-GLOY
Limpiador Facial De Ultrasonido R - Unidad a $22990,22.990,0,5.0,1,insanto
"Cepillo De Limpieza Facial De Silicona, 3 Diseos, Beomeen 4",153.409,0,0,0,Beomeen
Cepillo Facial  Cepillo De Limpieza Manual De Silicona De D,135.087,0,0,0,Fixoemvb
"Beomeen - Cepillo De Limpieza Facial Grande De Mano, 4 Unida",163.989,0,0,0,Beomeen
Beomeen Cepillo De Limpieza Facial 2 En 1 Para Exfoliacin Fa,153.409,0,0,0,Beomeen
Touchbeauty Juego De Cepillos De Limpieza Facial Con Estuche,178.689,0,0,0,TouchBeauty
Cepillo Facial Rutina Skincare,19.900,0,0,0,Cepillo Facial Revitaliza Piel Sana Radiante
"Cepillo De Limpieza Facial, 3 En 1 Elctrico De Silicona Para",178.689,0,0,0,Uimoky
"Cepillo De Limpieza Facial Touchbeauty, Cepillo Giratorio De",195.981,0,0,0,TouchBeauty
Cuidado Piel Acido Glicólico - Unidad a $32,80.000,0,0,0,Elaimei
"Brochas Faciales Para Limpieza Y Exfoliacin, Cepillo De Limp",322.792,0,0,0,BSROLUNA
Limpiador Facial Exfoliante Masajeador 8cm Luna Recargable,17.490,0,5.0,1,EEGANCE
Hue - Cepillo De Limpieza Facial 3 En 1 Elctrico De Silicona,144.104,0,0,0,HUE DECORATION
"Beomeen 7 Unidades De Cepillos De Limpieza Facial, Exfoliant",138.340,0,0,0,Beomeen
"Beomeen Cepillo De Limpieza Facial Para Exfoliacin Facial, C",121.047,0,0,0,Beomeen
Yebeauty Juego De 15 Cepillos De Limpieza Facial De Silicona,138.340,0,0,0,Yebeauty
"Hue - Cepillo De Limpieza Facial 3 En 1, Limpiador Facial De",138.340,0,0,0,HUE DECORATION
Nocturne Gel Limpiador Facial - Kg a $264,33.000,0,0,0,L'Bel
Cepillo De Limpieza Facial: Dispositivo Limpiador Elctrico E,167.160,0,0,0,COSLUS
"Cepillo De Limpieza Facial De Silicona 2 En 1, Limpiador Fac",121.047,0,0,0,MtBoi
"Brochas Faciales 6 En 1 Para Limpieza Y Exfoliacin, Cepillo",322.792,0,0,0,BSROLUNA
"Cepillos Faciales 6 En 1 Para Limpieza Y Exfoliacin, Cepillo",322.792,0,0,0,BSROLUNA
Limpiador Facial Martillo Azul F - Unidad a $134910,134.910,10,0,0,Denuevoo
"Limpiador Exfoliante Facial, Cepillo Manual De Limpieza Faci",132.576,0,0,0,Yiqingjie
"Cepillo De Limpieza Facial, Cepillo Elctrico Para La Cara, E",230.566,0,0,0,Orauley
Mymoosh - Cepillo De Limpieza Facial De Doble Cara Con Cerda,97.991,0,0,0,Mymoosh
"Compatible Con Cabezales De Cepillo De Limpieza Facial, Cabe",138.340,0,0,0,Acosexy
"Cepillo De Limpieza Facial De Repuesto Compatible, Cepillo D",155.632,0,0,0,Zanegear
Pala Ultrasonica Depurador Facial Ultrasonico Recargable,119.900,0,0,0,Genérica
Siwiey - Cepillo De Limpieza Facial Snico Impermeable Ipx7 P,167.160,0,0,0,siwiey
Hangsun Sc200 - Cepillo De Limpieza Facial Snico Para Limpie,305.500,0,0,0,Hangsun
"Nuogo Paquete De 40 Cepillos De Limpieza Facial, Exfoliante",184.453,0,0,0,Nuogo
Toallitas - Toallitas Faciales De Limpieza Simples Para La P,273.000,0,0,0,Simple
