product_name,price,discount,review_rating,review_amount,brand
Crema Blanqueadora De La Piel Crema Aclaradora Para Zonas Ín,47.861,10,3.8,8,Genérica
"Gainwell 100 Esponjas Faciales Comprimidas, Limpieza, Para U",216.888,0,0,0,Gainwell
Pomys Rueditas Desmaquillantes Faciales 6 Paquetes / 60 U,39.900,0,5.0,1,Pomys
Humidificador Facial Powerbank,22.473,10,0,0,Genérica
Máquina De Limpieza Facial Vibrate Scrubber Face Remover Arr,58.992,0,0,0,Genérica
"Aceite De Cyperus Rotundus,cyperus Plant Essential Oil",50.096,3,0,0,Generic
"2 Cepillos De Limpieza Facial, Limpiador Facial De Silicona",169.278,0,0,0,Leeshine
Pañuelos Familia Cuidado Gripal 4  Paquetes X 10und,7.550,0,5.0,3,Familia
 ,0,0,0,0,
Nano Vaporizador Humidificador Alcohol Y Agua En Promoción,17.990,0,0,0,Nano
Cepillo De Silicona Paralimpieza Facial Recargable Foreo 3d,65.900,0,0,0,Genérica
Jexcull - Juego De 4 Cepillos De Limpieza Facial De Silicona,137.539,0,0,0,JEXCULL
Humificador Vaporizador Facial Portátil Recargable Nano,19.990,0,0,0,Nano
Paños En Algodón Para Desmaquillar Almoadillas Para Limpieza,18.333,12,4.0,1,Importado TM
Crema Ponds Clarant B3 Piel Normal A Grasa 100g,21.714,23,5.0,2,Pond's
Cepillo Masajeador Limpieza Facial Corporal Pulpo Exfoliant,3.681,0,0,0,My Beauty Tool
Cepillo De Limpieza Facial Eléctrico 3 En 1 Giratorio,194.721,0,0,0,Generic
Cepillo De Limpieza Facial: Dispositivo Limpiador Elctrico E,238.048,0,0,0,COSLUS
Exfoliante Facial Celulosa X2 ,9.341,15,4.5,4,10MILAZO
"2pcs Aceite De Cyperus Rotundus,cyperus Plant Essential Oil",66.165,13,0,0,Generic
Dermapen Derma Dr Pen Ultima A6 Eléctrico Inalámbrico Kit ,296.990,0,4.4,34,Dr. Pen
Magnesium Oil Spray Puro Magnesium Topic Spray,65.718,7,0,0,Generic
"2 Esponjas Faciales, Almohadillas De Limpieza Facial, Esponj",153.409,0,0,0,Consio
Cepillo Facial Limpieza Sonic2- - Unidad a $34900,34.900,0,0,0,Sonic
Essential Loción Desmaqillante Para Ojo - mL a $202,25.286,6,4.8,4,L'Bel
Litro De Agua De Rosas Facial - L a $8455,8.900,0,5.0,3,x
Gel Garnier Limpieza X 150 Ml,32.900,0,4.5,2,Garnier
"Cepillo De Limpieza Facial, Limpiador Facial De Mano De Sili",137.539,0,0,0,Ejoyous
"Cepillo De Limpieza Facial, Cepillo De Limpieza Facial Eléct",300.900,0,0,0,Sinloog
Toalla Desmaquillante Reusable,16.000,0,4.7,3,Viznu
Agua Micelar Express Aclara Garnier - mL a $72,28.903,0,4.8,15,Garnier
Oferta Agua Micelar Pomys Rosas 400ml + Gratis Rueditas,24.050,0,0,0,Familia
 Agua Micelar Facial Mary Kay,40.900,0,5.0,1,Mary Kay
Tbestmax Cepillo Facial Manual Limpiador De Limpieza De La P,111.328,0,0,0,Tbestmax
Vaporizador Sauna Facial Digital Profesional Rejuvenecedor ,69.900,0,4.7,9,Benice
"Cepillo De Limpieza Facial Con Pantalla Lcd, Aspiradora Reca",278.966,0,0,0,Hmpbefu
Probiótico Glp-1 Para El Control Del Peso Y El Intestino,100.120,0,0,0,Generic
La Roche Posay Mela B3 Serum Antimanchas 30ml 100% Original,117.681,0,0,0,La Roche-Posay
"Limpiador Facial, Mini Spa Eléctrico 5 En 1",11.000,0,4.6,20,Brand not found
Cepillo Exfoliante Facial,22.000,0,4.1,9,GypsyMarket Co
Limpiador Facial Beurer Fc96 - Kg,416.894,37,0,0,Beurer
Cepillo De Limpieza Facial Manual Ultrasuave De Eliminacin D,185.148,0,0,0,Vincilee
Limpiador Eléctrico Facial Recargable Usb Pingüino Rosa,16.500,0,0,0,AsianBeauty
"Limpiador Facial, Mini Spa Eléctrico 5 En 1",11.000,0,4.6,20,Brand not found
Cepillo Exfoliante Facial,22.000,0,4.1,9,GypsyMarket Co
Agua Micelar 220ml Kosmaderm - mL a $118,25.900,0,0,0,Kosmaderm
Radiofrecuencia Rejuvenecimiento Facial Mini Hifu Portatil,219.900,0,4.0,2,Mini Hifu
Esponja De Limpieza Facial Facial Esponja De Lavado 2 Piezas,115.283,0,0,0,Exceart
"12*mascarilla Bio-collagen Real Deep, Hidratante Duran",108.794,0,4.0,1,Genérico
Jabón Facial Asepxia Antiacné Exfoliante 100 G,13.400,0,0,0,Asepxia
Dispositivo De Limpieza Facial Pmd Beauty Clean Mini Silicon,308.360,0,0,0,Pmd Beauty
"Nad Nicotinamida Riboside Resveratrol 900 Mg, Suplemento 2 U",127.454,9,5.0,1,Generic
Cepillo De Limpieza Facial: Dispositivo Limpiador Electrico ,149.868,0,0,0,COSLUS
Rueditas Desmaquilladoras Pomys Original X 60und,8.350,0,5.0,1,Pomys
Gel Aquasense Hidratante Limpiador X 400ml,106.000,0,4.0,1,Aquasense
Vaporizador Limpieza Facial + Molde Silicona Hielo Skin Care,26.900,0,0,0,Genérica
Cepillo De Limpieza Facial Recarg - Unidad a $42000,42.000,0,0,0,rasp sap
Tbestmax Cepillo Facial Manual Limpiador De Limpieza De La P,103.755,0,0,0,Tbestmax
Supraderm Cuidado De La Piel - mL a $400,48.000,0,5.0,3,Supraderm
Vaporizador Facial Portatil,10.900,0,5.0,4,ICO
Vapor Ozono Profesional Calor Y Frío,569.900,0,0,0,Vapor
Vapor Ozono Facial Capilar 2en1,254.900,0,3.3,3,Facial Beauty
"2 Cepillos De Limpieza Facial, Limpiador Facial De Silicona",115.283,0,0,0,Leeshine
"Máquina De Limpieza Facial, Dispositivo Para Pelar La Piel,",61.515,6,0,0,Generic
Gotas Estimulantes Y Quemadoras De Saciedad Glp-1 De W&napha,96.975,10,0,0,Generic
Vapor Ozono Facial Profesional ,45.999,0,5.0,1,Osenjie
"2 Esponjas Faciales, Almohadillas De Limpieza Facial, Esponj",103.755,0,0,0,Consio
"Syeyyds Cepillo De Limpieza Facial, Estropajo Facial De Sili",135.900,0,0,0,Syeyyds
Dermapen Dr Pen M7 Inalámbrico+2 Cartuchos De Agujas,204.999,0,5.0,1,Dr Pen
Leche Limpiadora Avene Suavizante X 200ml,93.555,30,5.0,4,Avène
"Fubsta Ultra Firming & Revitalizing Cream, 3un",85.962,12,0,0,Generic
"Mascarilla Biodance Bio Collagen Real Deep, 4 Unidades/caja",54.964,5,0,0,Génerico
Gainwell 50 Esponjas Faciales Comprimidas Para Limpieza Faci,138.340,0,0,0,Gainwell
Touchbeauty Cepillo De Giro De Limpieza Facial A Prueba De A,171.900,0,0,0,TouchBeauty
Fh Kelo-cote Gel For Las Cicatrices 15 G,65.718,23,0,0,Generic
"Paquete De 20 Cepillos De Limpieza Facial De Silicona Suave,",115.283,0,0,0,Nuogo
2 Units Roche Posay Effaclar/retinol B3/hyalu B5/vitamin,110.106,12,5.0,1,Generic
"Cepillo De Limpieza Facial, Ckeyin 3 En 1 Electrico Exfolian",301.348,0,0,0,CkeyiN
Crema Sébium Mat Control Para Piel Grasa - 1 Fl. Oz.,83.730,0,0,0,Generic
Esponja Facial Celulosa Comprim - Unidad a $1090,10.900,0,0,0,Chivey
Crema De Ojos Beauty Of Joseon North American Beauty,63.638,0,0,0,WERG
"Cepillo De Limpieza Facial, Exfoliante De Silicona Umickoo,",156.340,0,0,0,Umickoo
Alta Frecuencia 7 Electrodos,128.155,5,5.0,2,High Frequency
Cepillo Eléctrico Facial Exfoliante Con 7 Cabezales,80.990,0,0,0,Visofo
Pulverizador Portátil Nano Spray Fogger Portátil De Luz 1 Un,164.299,5,0,0,"Generic,vapor de ozonio cabelo,pulverizador facial,nano pulverizador,pistola nano vaporizador,nano vaporizador facial,hair ozone steam, facial spray, nano spray, nano spray gun, nano facial spray"
"Cinta De Estiramiento Facial, Cinta Facial Invisible Como",76.112,5,0,0,Generic
Kit De Tratamiento Para El Acné Cepillo De Limpieza Facial S,167.284,0,0,0,Acnefree
Vapor Ozono  Lupa Lámpara Pedes,599.000,0,5.0,1,Vapor Ozono De Pedestal
Solucion Micelar Isdin 4 En 1 X 100ml,38.000,0,4.7,3,Isdin
"Lápiz Labial Teñido Rhode Hailey Bieber, 2 Unidades",61.072,7,0,0,generic
"Cepillo De Limpieza Facial, Exfoliante Eléctrico Recargable ",225.744,0,0,0,Orauley
Desmaquillante Gel Dificil Reti - g a $427,29.900,0,0,0,Trendy
"Avilana Limpiador Facial De Silicona, Cepillo De Limpieza Fa",116.425,0,0,0,Avilana
"Limpiador Facial, Mini Spa Eléctrico 5 En 1",11.000,0,4.6,20,Brand not found
Cepillo Exfoliante Facial,22.000,0,4.1,9,GypsyMarket Co
Vapor Ozono Pedestal Digital,340.000,0,0,0,HOT VAPOUR
"Crema Terapéutica Perfectx Para Articulaciones Y Huesos, 2 P",53.106,0,5.0,1,generic
Cepillo Limpieza Facial 5en1spa - Unidad a $31700,31.700,0,0,0,Genérica
"50 Esponjas Faciales Comprimidas Para Esteticistas, Esponja ",116.425,0,0,0,Metuuter
Crema Antiedad Para Ojeras Instantly Eye,93.422,0,0,0,Generic
4× Parche Curativo For Manchas Acné En Forma Estrella,83.836,0,4.3,3,Generic
"Collarín Inflable De Tres Capas, Corrector De Cuello De Cisn",57.531,13,5.0,6,Genérica
Fg 2 Unidades Roche Posay Effaclar/retinol B3/hyalu,88.510,23,0,0,LANGYIMD
Sukpsy 10 Esponjas De Limpieza Facial Ovaladas Para Eliminar,116.425,0,0,0,Sukpsy
Mini Spa  Facial Eléctrico 5en1,17.900,0,0,0,Genérica
"Máscara De Colágeno Para Envolver La Noche Medicube, 3 Unida",70.808,5,0,0,Generic
"2×la Barra For Dejar Fumar Es Más Fácil, Alivi",72.499,0,0,0,Generic
Crema Removedora De Verrugas O Moho De Efecto Rápido En La P,77.623,0,0,0,Generic
"4 × Mascarilla Profunda Biodance Bio Colágeno Real, 34 G",52.156,5,0,0,generic
Cepillo De Limpieza Facial: Dispositivo Limpiador Electrico ,151.352,0,0,0,COSLUS
Cepillo De Limpieza Facial Usb - Unidad a $37900,37.900,0,0,0,Genérica
Nihay Dispositivo De Estiramiento Facial Con Microcorriente,29.800,0,0,0,Nihay
2lambena Mascarilla Limpiadora Desmaquillante Puntos Negros,57.531,13,0,0,Generic
"Mascarilla Biodance Bio-collagen Real Deep, Hidratante Duran",56.844,4,5.0,1,Génerico
"2 Esponjas Faciales, Almohadillas De Limpieza Facial, Esponj",104.782,0,0,0,Consio
Cepillo Facial Eléctrico Con 6 Cabezales Para Limpieza Profu,66.990,0,0,0,CLSEVXY
"Crema Para Eliminar Verrugas Genitales Partes Privadas, 3 Un",76.112,5,0,0,Generic
"Pinzas Eliminadoras De Puntos Negros Faciales, Clip Remo De",46.423,12,0,0,Genérica
"2024 Crema Ultra Reafirmante Y Revitalizante Fubsta 2024,",67.179,5,0,0,Generic
Gotas Para Mujer E Potion Of Pleasure Peak Spanish Fly Drops,55.965,0,0,0,Genérica
Gainwell 50 Esponjas Faciales Comprimidas Para Limpieza Faci,145.531,0,0,0,Gainwell
Cepillo De Limpieza Facial De Doble Cara Revlon,111.522,9,0,0,Revlon
Bolígrafo Para Eliminar El Para Lápiz Verrugas Quitar,51.513,2,5.0,1,Other
2 Unidades Roche Posay Effaclar/retinol B3/hyalu B5/vitamina,116.087,0,0,0,Generic
2 Piezas [tocobo] Barra Solar Algodón Suave Spf50 Pa 0.67,55.584,5,0,0,Generic
10 Esponjas Faciales Para La Limpieza Diaria Exfoliante Faci,145.531,0,0,0,Lallisa
Crema Para Terapia De Huesos Y Articulaciones Beevana Bee Ve,50.982,3,4.4,19,Creme Para Terapia Óssea E Articular Beevana Bee Venom 119g
"Eliminación De Manchas En La Piel: Agua, Lunares, Condiloma,",48.680,8,0,0,Genérica
Dispositivo De Limpieza Facial Pmd Beauty Clean Mini Silicon,366.457,0,0,0,Pmd Beauty
"Crema Hidratante Facial Retinol Tretinoína, Humectante Facia",53.602,7,5.0,1,Generic
El Aerosol Para Hemorroides M Herbal Alivia La Hinchazón Y E,41.998,20,0,0,Generic
Cepillo De Limpieza Facial Face Scrubber: Coslus Ipx7,173.900,0,0,0,Coslus
"Crema De Progesterona Bioidéntica Para Mujer, Sin Soja, 100",70.100,11,5.0,1,Genérica
"3 Unidades Crema Reparadora Úlceras Por Decúbito, Reduce",81.507,0,5.0,8,Generic
Limpiador Facial Eléctrico Recargable Con 4 Cabezales Ipx-7,178.990,0,0,0,Iweel
"Mz 345 Relief Cream, 345 Intensive Repair Cream, 345",58.239,0,0,0,Generic
"Esponjas Faciales De Limpieza, Esponjas Faciales 30 Uds.",111.965,0,0,0,Other
"Cinta Bucal Para Dormir, 120 Unidades, Tiras Suaves Para Dor",45.140,15,4.2,5,Generic
L Crema Para Agrandar Los Senos 60 Ml 3 Piezas,70.100,11,5.0,1,Generic
Gotas Líquidas De Aceite Orgánico De Orégano De 60 Ml,69.215,7,0,0,Generic
Cepillo Eléctrico De Limpieza Facial Recargable Face Scrubbe,204.893,31,0,0,Generic
"Pomada Removedora De Verrugas Por Herpes Genital, 20g X 4uds",58.203,7,0,0,Generic
"Esponjas Faciales De Limpieza, Esponjas Faciales 10 Uds.",95.015,0,0,0,Other
"Limpiador Facial, Mini Spa Eléctrico 5 En 1",11.000,0,4.6,20,Brand not found
Cepillo Exfoliante Facial,22.000,0,4.1,9,GypsyMarket Co
"3×tinnitus Relief Spray, Effectively Hearing And Relieves",87.182,0,3.7,6,Generic
"Rejuvenecimiento Facial De Alta Frecuencia Con Hifu, Estiram",187.759,0,0,0,OEM
Cepillo De Limpieza Facial Michael Todd Soniclear Allure 202,625.112,0,0,0,Michael Todd
"Crema Eficaz Para Agrandar Glúteos Y Caderas, 2 Unidades",66.382,4,0,0,Generic
Suplemento De Nicotinamida Nad-ribósido Nad 900 Mg,53.106,0,0,0,Generic
Crema Blanqueadora De Nieve Para Aclarar La Piel De Las Axil,49.249,10,4.0,1,Generic
Revitalash Senior Pestañas Acondicionador  3.5ml,166.909,0,0,0,Revitalash
Cepillo Facial Sónico De Silicona Ultra Higiénica Gris,179.990,0,0,0,Ezbasics
Cepillo Limpiador Facial Rostro,34.900,0,5.0,1,"Limpieza profunda y suave vibración ultra sónica que elimina eficazmente los residuos cosméticos, aceite y células muertas de la piel, acné y cabezas negras y disminuye los poros."
"Aerosol Antiácaros H, Eliminador Ácaros Qt7h Y Alivio Del",48.680,8,0,0,Genérica
Revitalash Cosmetics Cejas Essence 3.0ml,162.415,0,0,0,Revitalash
Reus Research Nr900 - Nad + Suplementos Energéticos,148.785,0,0,0,NMN
18 Pads Reusables Limpieza Facial Algo - Kg a $1778,32.000,0,4.0,1,ProVIC
Cepillo Exfoliante De Limpieza Facial Manual Suave De Doble,66.869,38,0,0,Generic
Juego De Cepillos De Limpieza Facial Recargable Con 4 Cabeza,184.900,0,0,0,Cnaier
Avene Cleanance Agua  Micelar 400ml,144.000,0,0,0,Avène
2×crema Para La Psoriasis Y El Cuidado La Piel Ayurvédica,81.419,0,0,0,Generic
Cepillo De Limpieza Facial Manual De Doble Cara Suave,70.277,34,0,0,Generic
4x Crema De Masaje Reparadora Para Articulaciones Y Huesos,68.197,13,4.6,14,Perfectx
Cepillo Masajeador Spa Facial,28.900,0,0,0,Cepillo Masajeador Limpiador
Set De Limpieza De Pasta De Dientes Con Corrector De Color D,59.052,0,2.3,3,"other,v34,hi smile v34,hismile v34,v34 origina,clareador v34,branqueador dental,v34 origina,clareador v34,pasta clareadora dental"
"Aceite De Batana Crudo De Honduras, 100% Natural Y Orgánico,",114.436,0,0,0,General
2 Unidades Crema Para Ojos Dos Minutos Para Quitar Bolsas,81.507,0,0,0,Genérica
"Cepillo Facial De Silicona Para Limpieza Y Exfoliación, 5 Pz",57.708,33,0,0,Generic
Set De Regalo De 3 Cremas De Manos Enriquecidas Con Manteca,51.778,9,0,0,Generic
Dispositivo De Limpieza Facial Pmd Clean Con Cepillo De Sili,545.662,9,0,0,Pmd Beauty
Pomys Rueditas Desmaquillantes Sensitive - G A $8,11.900,0,5.0,1,Pomys
"Cepillo De Limpieza Facial Para Manicura, 6 Unidades",53.637,28,0,0,Genérica
Discos Desmaquillantes Reutilizables Pom - G A $125,11.900,0,0,0,Pomys
Cepillo Facial Limpieza Sonic 2 E - Unidad a $34900,34.900,0,0,0,Brand not found
"Cepillo De Limpieza Facial Para Uñas, Cabeza Redonda, 6 Unid",54.534,27,0,0,Genérica
"Desmaquillante Restaurador Freeman + Bálsamo Limpiador, Mois",64.990,0,0,0,Freeman
"Máquina De Limpieza Facial, Exfoliante Facial, Herramienta R",66.648,0,0,0,Genérica
Vicks Inhalador De Vapor Personal Alivio Congestion Y Tos,268.900,0,0,0,Vicks
Cepillo De Limpieza Facial Foreo Luna 4 Sensitive Con Limpia,1.296.666,0,0,0,Foreo
Mesoterapia Pistola Inyección Pigmento Agujas 5 Pines X 100,2.499.000,0,0,0,Dower Me
Mesoterapia Pistola Inyección Pigmento Agujas 9 Pines A X 10,319.000,0,5.0,1,Dower Me
Limpiador De Plata De Wright Y Crema De Pulido - 8 Onzas,114.000,0,0,0,Wrights
"Umickoo Cepillo De Limpieza Facial, Limpiador Facial Sónico ",185.925,0,0,0,Umickoo
"Cepillo De Limpieza Facial Manual, Jabón Facial De Mano, Sua",48.769,28,0,0,Generic
Sauna Facial Vaporizador Limpieza Poros Puntos Negros,60.900,0,0,0,Osenje
Crema Facial Eucerin Antipigmentaria Antimanchas Noche 50ml,89.057,0,0,0,Eucerin
Lipiel Face - Novaderma 160 Ml - mL a $624,99.900,0,0,0,Novaderma
Agua Micellar Desmaquillante Nivea Agua De Rosas 100 Ml,15.000,0,4.5,12,Nivea
Corrector De Parches Para Orejas Corrector De Orejas,45.233,16,2.0,5,Genérica
6 Paquete De 5-6 Cepillos Faciales De Silicona Con 6 Piezas,52.664,13,0,0,Other
Limpiador Facial - Unidad a $28300,28.300,0,0,0,Tienda OddjobStore
Sérum Facial Coreano Mixsoon Soybean Essence Repara Los Daño,114.241,0,0,0,Generic
"Limpiador Facial, Mini Spa Eléctrico 5 En 1",11.000,0,4.6,20,Brand not found
Cepillo Exfoliante Facial,22.000,0,4.1,9,GypsyMarket Co
Máscara Profunda Biodance Bio Collagen Real 4 Unidades/caixa,49.210,8,0,0,Generic
Deos Suplementos Desodorantes Para Uso Interno,117.364,0,0,0,DEOS
"Cepillo De Limpieza Facial, 3 Piezas, Exfoliante Facial De S",92.581,44,0,0,Generic
Limpiadora Facial Eléctrica Reca - Unidad a $151950,151.950,0,0,0,Generic
Vapor Ozono Facial Portatil,199.500,5,5.0,2,Steam
Papel Absorbente Elimina Grasa,14.900,0,0,0,Papelitos Elimina Grasa Piel Facial
Aceite Limpiador Centella,85.000,0,0,0,Skin1004
3× Fresh Breath Essence - Gotas Menta For El Mal Aliento,74.724,0,0,0,Generic
Lindo Cepillo De Limpieza Facial De Silicona Con Forma De,103.955,3,0,0,Generic
/ Máquina Succión Espinillas Acné Usb Limpieza Facial,66.680,16,0,0,Generic
Pendulum Metabolic Daily Con Akkermansia Muciniphila 30 Cáps,110.416,29,0,0,Pendulum
"Crema Reafirmante Para El Cuello Gopure, (2 Unidades)",106.167,4,0,0,Generic
"Exfoliante Para La Salud De La Piel Zo Skin Health,",159.030,0,0,0,Generic
Cepillo Facial Sillicone Limpieza Profunda Poro Cuidado De,98.600,3,0,0,Generic
Synderm Plus Pharmaderm X 280ml,68.900,0,4.0,1,Pharmaderm
Cepillo De Limpieza Facial De 3 Cabezales Intercambiables,258.295,0,0,0,AT MOUSE
Kit Facia Vaporizador Extractor,84.990,0,4.0,4,Genérica
Pistola Atomizadora Nano Inalám,84.900,0,0,0,"Generic,vapor de ozonio cabelo,pulverizador facial,nano pulverizador,pistola nano vaporizador,nano vaporizador facial"
Dermapen Dr. Pen A6 Inalámbrico,299.900,0,0,0,Dermapen Dr. Pen
Limpieza De Silicona Cepillo De Lavado Facial Limpiador,99.352,3,0,0,Generic
[tocobo] Barra Solar Suave De Algodón Spf50+ Pa+++ 0.67,57.263,0,2.2,5,Generic
Cepillo De Limpieza Facial Variedad Funciones Recargable 3d,62.900,0,5.0,1,Genérica
"Aerosol Nasal Antironquidos For Limpiar Los Pulmones, 3 Uni",80.436,0,5.0,2,Generic
Cepillo De Limpieza Facial Rico En Espuma Para Limpieza Prof,52.791,0,0,0,Generic
Sauna Facial Vaporizador Poros,76.000,0,0,0,uan pixel
"Cinta De Estiramiento Facial, Cinta De Elevación Invisible,",53.106,7,4.2,5,Genérica
Cepillo Limpieza Faciall Spa - Unidad a $17900,17.900,0,4.0,4,Genérica
Crema De Masaje Para Aliviar Articulaciones Y Huesos X 4,66.587,0,0,0,Perfectx
"Cepillo Facial Para Limpieza Facial, Mango De Haya, Cerdas D",53.106,44,0,0,Generic
Microcorriente Rodillo Facial En Forma De V En Forma De V,63.397,3,5.0,1,Genérica
"3 Noni Fruit Serum, Noni Energy Ampoule, Noni Extract Facial",61.355,0,0,0,Generic
"Máscara De Colágeno 12 Biodance, Máscara De Colágeno Noturna",90.722,0,0,0,General
Crema Ponds Clarant B3 Piel Grasa 200 Gr,58.800,0,5.0,6,Pond's
Cepillo Limpieza Facial,30.863,0,0,0,Lori
Cepillos Faciales Del Lavado Púrpura,113.469,0,0,0,Other
Crema Facial Antienvejecimiento 6 En 1 Para Hombres,48.902,14,4.0,2,Genérica
Humidificador Nano Spray Vaporiza Cl-l20,30.900,0,5.0,3,Nano Sprye
"Fg 3pcs Gotas De Extracto De Hoja De Gordolobo,pulmones",84.999,20,5.0,1,LANGYIMD
"Nouelv Suero 10% Niacinamida + 4% Ácido Tranexámico,",80.721,3,0,0,Genérica
Cepillo Facial De Limpieza Manual Con Mango De Haya Y Cerdas,49.388,37,0,0,Generic
Cepillo De Limpieza Facial De Silicona Foreo Luna Mini 3 Min,896.160,9,0,0,Foreo
Sauna Facial Vaporizador ,46.900,0,3.0,3,Brand not found
Crema De Jengibre Para Ginecomastia: Reafirmante Y Estimulan,63.063,4,5.0,1,Genérica
2 Piezas Sérum Reductor Instantáneo De Arrugas: Avanzado,76.937,0,0,0,Generic
"2×útil Tensor De Ojos Instantáneo,la Mejor Crema For Bolsas",70.346,0,0,0,Genérica
"Cepillo De Limpieza De Doble Cara, 3 Unidades",59.965,24,0,0,Genérica
"Exfoliante Facial, Cepillo De Limpieza Facial A Prueba De Ag",178.901,0,0,0,QD-Gotrays
Ageloc® Lumispa® Limpiador-piel Seca 10 - mL a $765,76.533,3,0,0,Nu Skin
Dispositivo Estiramiento Facial Cara Cuello Antiarrugas,39.900,0,0,0,Genérica
"Cepillo De Limpieza, Cepillo Facial, 10 Unidades",75.145,20,0,0,Genérica
Cepillo Eco Bamboo Limpieza Facial Cuidado Personal,45.900,0,0,0,Genérica
Vaporizador Facial Portátil Lim,49.900,0,0,0,Osenjie
Vaporizador Facial Sauna Limpia Poros,44.900,0,0,0,Genérica
"Dispositivo De Estiramiento Facial Con Microcorriente Usb, L",42.900,0,0,0,2024
2 × Crema Para Senos Eficaz Rtopr Essence Para Mejorar Los S,81.871,0,5.0,1,Generic
"Cepillo De Limpieza De Doble Cara, 3 Unidades",61.558,22,0,0,Genérica
Depurador Facial | Cepillo De Limpieza Facial Exfoliante Ski,114.601,0,0,0,Visofo
Aceite De Ricino Orgánico Prensado En Frío Para Crecimiento,65.143,8,5.0,2,Genérica
Fd 3* Gotas De Vitaminas Para El Meyabolismo Para,75.570,19,0,0,LANGYIMD
"Cepillo Limpiador De Uñas Para Manos, Limpieza Facial, Pedic",70.365,25,0,0,Genérica
2 Unidades De Aceite Adelgazante De Jengibre Y Jengibre Para,52.159,8,0,0,Genérica
Dispositivo De Limpieza Facial Pmd Beauty Clean Pro Silver,1.111.238,10,0,0,Pmd Beauty
"Crema Eliminación Lipomas A Base Hierbas, Crema ",62.001,0,2.7,3,Generic
Combo Alta Frecuencia 4 Electrodos+vapor Ozono Portátil,349.999,0,5.0,1,Beauty
"Cinta Bucal Para Dormir, 120 Unidades, Tiras Creativas Para",48.680,8,5.0,2,Genérica
"Cepillo De Limpieza, Cepillo Facial, Manicura, 6 Unidades",55.850,24,0,0,Genérica
Ossion Mascariila Facial Carbon - mL a $279,34.900,0,0,0,Ossion
"Dispositivo De Limpieza Facial Pmd Clean Pro, Cepillo De Sil",844.382,9,0,0,Pmd Beauty
"Crema Progesterona Y Progesterona For Mujer, Sin Soja, 1",61.238,0,0,0,Generic
"Cepillo De Limpieza Facial Con Funda, 6 Unidades",56.204,24,0,0,Genérica
Nihay Dispositivo Usb De Estiramiento Facial En T Con,30.000,0,0,0,Generic
Gel Limpiador Facial Mixta A Grasa 145ml,24.900,16,5.0,3,Pomys
Ff Perlas Vaginales Detox Perlas 7 Piezas,64.635,19,0,0,Generic
Dispositivo De Limpieza Facial Pmd Clean Con Cepillo De Sili,603.314,0,0,0,Pmd Beauty
Agua Micelar Bioderma Sensibio H2o 500ml,116.132,0,3.9,31,Bioderma
Jabón Facial Anamaria Líq100 Gr - mL a $223,22.337,0,0,0,Ana Maria
Vaporizador Spray Rostro Conejo,28.900,0,0,0,Home Store
Agua Micelar Arroz Desmaquillante - mL a $131,10.500,0,5.0,1,Mecow
Cepillo De Limpieza Facial Muje,20.000,0,0,0,Cepillo facial
"Esponjas De Limpieza Facial Naturales, 20 Esponjas Faciales",97.991,0,0,0,Fintozer
"Aceite Para El Cuidado Del Cabello G Batana, Nutritivo, Suav",42.296,20,5.0,2,Generic
Limpiador Cetaphil Piel,68.950,0,5.0,2,Cetaphil
Vaporizador Facial Nano Portáti,11.305,0,4.3,7,MAXI_VENTAS_MEDELLIN
Combo Vapor Ozono Portátil+peeling Scrubber Ultrasonido Skin,339.999,0,0,0,Beauty
"Kikumasamune Limpiador Facial Japanese Sake, Limpieza Facial",126.811,0,0,0,Kikumasamune
Hidratador Portatil Facial Difu,16.700,0,5.0,1,Nano
"Crema Reafirmante Para Ojos Verfons Snake Venom, 2 Paquetes",57.116,2,0,0,Generic
Vaporizador Facial Recargable,13.800,0,0,0,Genérica
Parche Curativo For Manchas Acné En Forma Estrella,52.835,0,0,0,Generic
"Avilana Limpiador Facial De Silicona, Cepillo De Limpieza Fa",121.047,0,0,0,Avilana
3 Duo De Cepillos De Silicona Para Rostro: Suavidad 3 Piezas,52.719,13,0,0,Other
Toallas Desmaquillantes Bioaqua,13.990,0,0,0,Bioaqua
Cepillo Limpiador Facial Skinvigorate Sonic Mary Kay Color Blanco,0,0,5.0,1,Mary Kay
Agua Desmaquillante Bioaqua,10.999,0,0,0,Bioaqua
"Vaomts Cepillo De Limpieza Facial, Exfoliante Facial De Sili",155.632,0,0,0,Vaomts
"Crema Para Eliminar Cicatrices K, Crema Reparadora De Cicatr",53.106,7,5.0,1,Generic
Agua Desmaquillante Bioaqua,10.999,0,0,0,Bioaqua
"Crema Para Eliminar Cicatrices K, Crema Reparadora De Cicatr",53.106,7,5.0,1,Generic
Útil Pelo De Jabón Negro Hermoso Cabello Negro Hermoso Revit,48.105,10,4.0,1,Generic
"Cepillo Facial De Silicona Para Hombres, Cepillo De Limpieza",115.283,0,0,0,Vwmyq
Crema Reafirmante Y Reductora De Arrugas Avanzada Fubsta Tig,49.784,6,0,0,Generic
Keep Long Time Spray Extenal Men Delay Spray,43.016,19,5.0,1,Generic
"W Presbicia Visionrestore Gotas Oculares 10 Unidades* 0,7 Ml",53.106,0,0,0,Generic
Crema De Astaxantina Para Una Hidratación Profunda Y De Alta,45.140,15,5.0,3,Generic
Gainwell 50 Esponjas Faciales Comprimidas Para Limpieza Faci,149.868,0,0,0,Gainwell
Microingredientes De Vitaminas D3 K2 10000 Ui (mk-7) 200 Mcg,93.289,0,0,0,Generic
10 Velas De Oído P Natural Ear Candles Wax Re 3092,42.296,20,5.0,1,Generic
Cepillo Eco Bamboo Limpieza Facial Cuidado Piel,28.900,0,0,0,Genérica
Exfoliador Masajeador Limpiador Facial X 2 Unidades ,14.441,15,3.9,7,10Milazo
Jexcull - Paquete De 4 Cepillos De Limpieza Facial De Silico,92.227,0,0,0,JEXCULL
"2024 Agua De Colonia Her Loss For Hombre - 100 Ml (3,3 Oz)",117.185,0,0,0,General
Vaporizador Aromaterapia Facial,79.900,0,0,0,Vaporizador Facial Aromaterapia Limpieza Belleza Facial
120 Esponjas Faciales Celulosa,100.822,15,3.0,4,Chivey
"Cepillo Facial Eléctrico Con Estación De Limpieza, Cepillos ",445.867,0,0,0,Kimairay
Vapor Ozono Facial Profesional,60.000,0,0,0,Osenjie
"2 Esponjas Faciales, Almohadillas De Limpieza Facial, Esponj",109.519,0,0,0,Consio
Suero Refinador De Poros Con Ácido Lactobiónico B Essence Mo,40.891,23,0,0,Generic
"Limpiador Ultrasónico Facial, Limpieza Facial Profunda",44.900,0,0,0,Genérica
Toallitas Cetaphil limpieza facial 25 unidades,0,0,0,0,Cetaphil
Cepillo Electrico Vibrador Limpieza Facial Geske Smartappcep,241.900,0,0,0,Geske
Cepillo De Limpieza Facial: Dispositivo Limpiador Electrico ,155.632,0,0,0,COSLUS
"Crema De Ojos Antiarrugas Con Colágeno, Nutritiva Y Hidratan",37.698,30,0,0,Generic
"Crema Para Aliviar El Dolor Articular Con Veneno De Abeja, 5",103.423,5,5.0,2,Generic
Crema De Tratamiento Aclarante Para Manchas Blancas Y Cuidad,80.589,5,0,0,Generic
Para Sérum Fortificador Vichy Minéral 89 50ml,71.250,0,0,0,Generic
Cepillo Eco Bamboo Limpieza Facial Cuidado Piel,30.900,0,0,0,Genérica
10 Esponjas Faciales Para La Limpieza Diaria Exfoliante Faci,149.868,0,0,0,Lallisa
Sérum Facial Antimanchas Eucerin Anti Pigment Dual 30 Ml,119.444,0,0,0,Eucerin
Dermapen Dr Pen Recargable Facial,119.900,0,0,0,Dermapen
Paño Removedor Reutilizable Generic Noni Fruit Serum 2 Pcs,65.584,0,0,0,Generic
* * N Nello Supercalm Drink In Polvo Frambuesa Limon:,67.105,0,0,0,Generic
Sukpsy 10 Esponjas De Limpieza Facial Ovaladas Para Eliminar,121.047,0,0,0,Sukpsy
Cepillo Eco Bamboo Limpieza Facial Cuidado Piel,45.900,0,0,0,Genérica
El Aerosol Nasal A Base De Hierbas Lung Detox Alivia La Rini,57.531,4,0,0,Genérica
Esponja Pomo Desmaquillante - Unidad a $9594,9.594,40,3.9,7,10MILAZO
